questions,option_A,option_B,option_C,option_D,option_E,correct_answer
¿Cuál de las siguientes condiciones es una causa de nefrocalcinosis en la infancia?,Hipoparatiroidismo,Síndrome de Potter,Vejiga hiperactiva,Síndrome de Cushing,Reflujo vesicoureteral,D
"¿Cuál es el fármaco antiangiogénico inhibidor de la enzima mTOR utilizado en el tratamiento del cáncer renal 
metastásico?",Temsirolimus,Sunitinib,Interferón alfa,Interleukina 2,Bevacizumab,A
Los cálculos urinarios están frecuentemente formados de...,ácido úrico.,oxalato de cálcio.,fosfato de amonio magnésico.,fosfato de cálcio.,cistina.,B
"Mujer de 42 años, trasplantada renal desde hace 2 meses, acude por aumento de vello facial, no otras molestias. 
Examen: hirsutismo. ¿Cuál de los siguientes fármacos está relacionado con este efecto secundario?",Everolimus,Micofenolato,Azatioprina,Belatacept,Ciclosporina,E
"¿Cuál de los siguientes tratamientos para la vejiga hiperactiva refractaria, aún no tiene aprobación por la FDA?",Inyección intravesical de toxina botulínica,Cistoplastía de aumento,Estimulación percutánea del nervio tibial,Neuromodulación sacra,Derivación quirúrgica urinaria,A
¿Cuál es un factor de riesgo para el cáncer de vejiga?,Exposición a aminas aromáticas,Ingesta alta de grasas saturadas,Alta exposición a luz solar,Abuso de penicilinas,Alta ingesta de picantes.,A
¿Cuál es la causa más frecuente de hidronefrosis fetal?,Quiste para-piélico gigante,Reflujo vesicoureteral,Litiasis renal coraliforme,Estenosis de unión pieloureteral,Valvas uretrales posteriores,D
¿Qué fármaco es utilizado para el tratamiento de la enuresis nocturna?,Bloqueador beta adrenérgico,Antagonista de renina-angiotensina,Acetato de desmopresina,Micofenolato de mofetilo,Citrato de potasio,C
"Tumor de pelvis renal que invade tejido subepitelial, no infiltra muscularis, grasa peripélvica ni parénquima renal. ¿Qué 
clasificación le corresponde, según el TNM?",T2,T3,T4,T1,T0,D
"En un paciente con Parkinson. ¿Cómo se denomina a la presencia de contracciones involuntarias del detrusor durante 
la fase de llenado del estudio urodinámico?",Hiperreflexia neurógena,Inestabilidad neurógena,Hiperactividad idiopática,Hiperreflexia idiopática,Hiperactividad neurógena,E
"Varón de 60 años con aumento de volumen testicular derecho desde hace 2 meses. Desde hace un mes pérdida de 
líbido y aumento de volumen y sensibilidad de ambos pezones. Examen: tumoración dura de 2x2 cm en testículo 
derecho, no dolorosa, no flogosis, tórax: ginecomastia bilateral. Ecografía testicular: tumoración sólida en testículo 
derecho, epidídimo sin alteraciones, marcadores tumorales negativos. ¿Cuál es el diagnóstico más probable?",Tumor de células de Leydig,Coriocarcinoma,Quiste epidermoide,Adenocarcinoma del rete testis,Linfoma testicular,A
La disfunción vesical neurógena infantil generalmente es consecuencia de...,traumatismo vertebral.,tumores del sistema nervioso.,reflujo vesicoureteral.,defectos del tubo neural.,cistitis crónicas.,D
"Varón de 16 años con disuria y secreción purulenta verde-amarillenta en gran cantidad por meato uretral, hace 5 días 
tuvo relaciones sexuales sin protección. ¿Cúal es el tratamiento más adecuado?",Ceftriaxona 1 g IM cada 12h por 3 días +,Ceftriaxona 500 mg IM dosis única + azitromicina,Ciprofloxacino 500mg VO cada 12h por 7 días +,Levofloxacino 750 mg VO dosis única +,Levofloxacino 500 mg VO cada 24h por 3 días +,B
"Varón de 40 años con aumento de volumen testicular derecho desde hace 5 meses, no dolor, no molestias urinarias. 
Examen: testículo derecho aumentado de tamaño y de consistencia dura e irregular, no se palpa epidídimo, cordón 
espermático engrosado, no dolor ni flogosis. ¿Cuál es el diagnóstico más probable?",Hidrocele,Quiste epidídimo,Varicocele,Tumor testicular,Orquiepididimitis,D
"Varón de 28 años, asintomático. Antecedente: hermano con cáncer de testículo. Examen: venas espermáticas se dilatan 
a la valsalva en bipedestación, resto sin alteraciones. Ecografía doppler testicular: varicocele leve izquierdo. ¿Cuál es 
la conducta a seguir?",No requiere tratamiento,Orquiectomía inguinal,Varicocelectomia laparoscópica,Escleroterapia venosa,Reposo absoluto,A
El uso de sildenafilo está contraindicado en pacientes en tratamiento con...,enalapril.,metformina.,nitratos.,nifedipino.,glimepiride.,C
"Varón de 16 años con diagnóstico de uretritis clamidiásica, es alérgico a macrólidos, y presentó vómitos con la 
primera dosis de doxiciclina. ¿Cuál sería el otro antibiótico de elección?",Cloranfenicol,Levofloxacino,Cefuroxima,Nitrofurantoina,Amoxicilina,B
"Varón de 32 años, desde hace 12 horas disuria, polaquiuria, dificultad para iniciar la micción, fiebre, malestar general 
y dolor suprapubico. Examen: mal estado general y compromiso hemodinámico. Hemograma: leucocitosis con 
desviación izquierda, examen de orina: leucocituria. ¿Cuál es el diagnóstico más probable?",Prostatitis aguda,Pielonefritis aguda,Uretritis,Orquiepididimitis,Retención urinaria,A
¿Cuál es el gérmen que más frecuentemente causa infección urinaria en pacientes hospitalizados?,Klebsiella spp,Proteus mirabilis,Enterobacter spp,Eschericha coli,Staphylococo aureus,D
¿Cuál es el medicamento utilizado como inmunoterapia intravesical para el tratamiento del cáncer de vejiga?,Mitomicina C,Gemcitabina,Thiotepa,Bacillus Calmette-Guerin,Doxorubicina,D
¿Cuál es el tipo histológico más frecuente del cáncer de vejiga?,Carcinoma urotelial,Carcinoma de células escamosas,Adenocarcinoma,Carcinoma de células claras,Leiomiosarcoma,A
"Mujer de 61 años, monorrena, con diagnóstico de tumor urotelial a nivel de pelvis renal. Uro-RMN: tumoración única 
papilar de aprox. 5mm, que no infiltra grasa perirenal, no hidronefrosis. Citología urinaria: carcinoma urotelial de bajo 
grado. ¿Cuál es la indicación terapéutica más adecuada?",Resección endoscópica con láser,Nefroureterectomía radical,Resección piélica laparoscópica,Quimioterapia neoadyuvante,Instilación percutánea de BCG,A
