questions,option_A,option_B,option_C,option_D,option_E,correct_answer
"Mujer de 49 años, G1P1001, con últimas menstruaciones irregulares, obesa; presenta pérdida involuntaria de orina 
acompañada o precedida por una imperiosa necesidad de miccionar, niega nicturia, niega incapacidad para vaciar la 
vejiga. Examen ginecológico normal. ¿Cuál es el diagnóstico más probable?",Incontinencia urinaria de esfuerzo,Incontinencia urinaria por rebosamiento,Incontinencia urinaria mixta,Síndrome de vejiga hiperactiva,Incontinencia urinaria de urgencia,E
"Mujer de 13 años, es llevada a consulta por sus padres por ausencia de menarquia, asintomática. Examen: masa 
levemente dolorosa a la palpación profunda en región inferior de abdomen, no signos peritoneales. Ecografía pélvica: 
tumor anexial complejo sólido, multilobulado, de 11 cm de diámetro y presencia de escaso líquido libre en cavidad. 
Gonadotrofina coriónica humana (+). ¿Cuál es el diagnóstico más probable?",Quiste ovárico funcional,Torsión anexial,Embarazo ectópico roto,Teratoma quístico maduro,Disgerminoma,E
"Varón de 65 años, ingresa a emergencia por hipotermia 35°C, FR 24 X', FC 120 X', PA 80/40 mmHg, oliguria. 
Hemograma con leucocitos 3500/µl, plaquetas 60,000/µl, PH: 6.7. Luego de fluidoterapia y vasopresores por más 
de 90 minutos y sin respuesta favorable. ¿Cuál es el diagnóstico?",Bacteriemia,Septicemia grave,Sepsis,Shock hipovolémico,Shock séptico resistente,E
"¿Qué componente de la inmunidad innata fagocita y destruye microorganismos además de secretar citoquinas 
inflamatorias?",Epitelio,TNF- alfa,Lectina,IL-1,Macrófago,E
¿Que hallazgo clínico en un neonato de 5 días de edad sirve para descartar displasia de cadera?,Melanosis pustulosa transitoria,Ictericia en cara y tórax,Asimetría de pliegues,Signo de Ortolani positivo,Ampolla de succión en una mano,D
¿Cuál de las siguientes alternativas es causa de hipopotasemia asociada a hipertensión arterial?,Uso de glucocorticoides,Tratamiento con Anfotericina B,Acidosis tubular renal,Uso de insulina,Aldosteronismo primario,E
"Lactante de 6 semanas, nacido de parto eutócico, APGAR 9, peso: 3,200 g, ganancia pondo estatural adecuada; 
presenta desde hace 3 semanas ictericia, orinas oscuras y deposiciones claras. Hace 2 semanas fue vacunado y 
presenta un hematoma en la zona de aplicación de la vacuna. Examen: ictericia, hepatomegalia. ¿Cuál es el 
diagnóstico probable?",Galactosemia,Atresia de vías biliares,Ictericia fisiológica,Estenosis pilórica,Ictericia por leche materna,B
"Lactante de 2 meses de edad, hospitalizado con diagnóstico de bronquiolitis, presentando hipoxemia. ¿Cuál es el pilar 
del tratamiento?",Oxígeno húmedo,Nebulización con salbutamol,Adrenalina nebulizada,Ribavirina endovenosa,Corticoides sistémicos,A
"Futbolista con dolor en rodilla derecha de 6 días de evolución, recibió tratamiento con AINES, hace 2 días presenta 
sensación de alza térmica e incapacidad funcional. Examen: PA: 140/80mmHg, FC: 100X'. T°39°C Sat. O2 97%, 
rodilla derecha aumentada de volumen, flogótica, dolorosa a la movilización; se diagnostica artritis séptica. ¿Cuál es la 
conducta terapéutica a seguir?",Artrotomía abierta y drenaje,Antibioticoterapia sistémica,Punción articular y drenaje,Artrotomía abierta e irrigación,Debridamiento e irrigación por artroscopia,E
¿Cuál es la complicación más frecuente de la sinusitis en la infancia?,Trombosis del seno cavernoso,Absceso epidural,Celulitis orbitaria,Meningitis,Osteomielitis del hueso frontal,C
¿La rápida apertura de qué canales voltaje dependientes determina el potencial de acción neuronal?,Magnesio,Sodio,Calcio,Potasio,Cloro,B
Lactante de 7 meses con antecedente de alergia a la proteina del huevo. ¿Qué vacuna está contraindicada?,Hepatitis B,Pentavalente,Neumococo,Haemophilus influenzae tipo B,Influenza,E
¿Por qué se caracterizan los problemas de violencia en la pareja?,Extrovertido,Comunicaciones negativas,Expectativas reales,Hijos adolescentes,Satisfacción laboral,B
"En adolescentes con infección de transmisión sexual por Chlamydia trachomatis. ¿Cuál es el tratamiento 
recomendado?",Amoxicilina 500 mg c/6 h/ 7 días VO,Cefalexina 500 mg c/6h/ 7 días VO,Penicilina Clemizol 1 millón U/ 3 días  IM,Azitromicina 1g/dosis única VO,Dicloxacilina 500 mg c/6h / 7 días VO,D
¿En dónde se ubican las células intercaladas o intercalares renales?,Túbulo conector,Túbulo colector,Asa de Henle,Túbulo proximal,Túbulo distal,B
"Varón de 86 años que hace 96 horas presenta dolor abdominal en cuadrante inferior derecho, asociado a náuseas sin 
vómito e hiporexia. Examen: PA: 120/60mmHg. T°: 37.5°C, FC: 100X'. Sat. O2 96%. Abdomen: dolor a la palpación en 
fosa iliaca derecha signo McBurney (-), signo de Blumberg (-).  Hemograma: leucocitos 10,000/µl con 8% 
abastonados. ¿Cuál es la conducta a seguir?",Apendicectomía,Antibioticoterapia y observación,Tomografía abdominal,Ecografía abdominal,Resonancia magnética,A
¿Cuál es el criterio mayor más frecuente para el diagnóstico de fiebre reumática?,Carditis,Eritema marginado,Corea,Fiebre,Artritis,E
"Mujer de 30 años con diagnóstico de colecistitis litiásica hace tres años, presenta dolor en hipocondrio derecho en 
forma súbita desde hace 24 horas, con ictericia. ¿Cuál es la conducta a seguir?",Colecistectomía abierta con exploración de vía biliar,Tomografía computarizada abdominal,Ecografía abdominal,CPRE con extracción endoscópica de cálculo en colédoco,Colecistectomía laparoscópica y exploración de vía biliar,D
El diagnóstico de enfermedad renal crónica se establece en base a...,la presencia de albuminuria masiva.,disminución persistente de la tasa de filtrado glomerular más de 3 meses.,tasa de filtrado glomerular menor a 30 ml/min/1.73m2.,hipertensión arterial refractaria.,alteración ecográfica que solo incluye disminución de tamaño renal.,B
