questions,option_A,option_B,option_C,option_D,option_E,correct_answer
¿Cuál es una técnica directa para evaluar el flujo sanguíneo cerebral?,Oftalmodinamometría,Sonografía Doppler periorbital direccional,Fotopletismografía supraorbital,Tomografía computarizada con emisión de fotón,Tomografía por compresión carotídea,D
"¿Cuál es el anestésico de acción corta que tiene como complicaciones el riesgo de alucinaciones en el despertar y 
el aumento de secreciones?",Fentanilo,Propofol,Lidocaína,Ketamina,Bupivacaína,D
"Varón de 55 años que es sometido a una cirugía de reconstrucción de la aorta abdominal, en el intraoperatorio se 
evidencia disminución del gasto cardiaco, aumento de la presión venosa central, aumento de la tensión del ventrículo 
izquierdo. AGA: alcalosis respiratoria. ¿Durante qué proceso se evidencia estos cambios fisiológicos?",Insuficiencia arterial renal,Infusión de nitroglicerina,Pinzamiento aórtico,Infarto agudo de miocardio,Enfermedad de Takotsubo,C
"Varón de 25 años que es sometido a una colecistectomía laparoscópica. Antecedente de DM tipo II, IMC:40, será 
sometido a un tiempo operatorio aproximadamente de 30 min. ¿Cuál es la conducta a seguir en la protección de la vía 
área?",Máscara laríngea de primera generación,Intubación selectiva bronquial,Traqueostomía percutánea,Cricotiroidectomía,Intubación endotraqueal e inducción de secuencia rápida,E
En las pruebas de compatibilidad cruzada. ¿En qué fase se detecta fundamentalmente anticuerpos del sistema Rh?,Primera,Tercera,Antiglobulina,Segunda,Inmediata,D
"En un bloqueo bajo, por debajo de T10 con técnica neuroaxial. ¿Cuál es la primera acción a desarrollar?",Evitar retirar catéter si persiste el bloqueo,Cambiar a anestesia general con halotano,Retirar el catéter y suspender la cirugía,Aplicar antinflamatorios no esteroideos por vía EV,Administrar 5-10 cc de mezcla analgésica por vía,E
