questions,option_A,option_B,option_C,option_D,option_E,correct_answer
"Ante la sospecha de trauma ocular con cuerpo extraño intraocular metálico. ¿Cuál es el estudio de imágenes que se 
contraindica?",Ecografía ocular,Resonancia magnética,Tomografía computarizada,Radiografía,Retinografía,B
¿Cuál de los siguientes es el patógeno habitual de la blefaritis angular?,Neisseria gonorrhoeae,Chlamydia trachomatis,Haemophilus influenzae,Moraxella lacunata,Neisseria meningitidis,D
"Varón de 26 años, con ojo rojo bilateral; hace 3 días contacto sexual casual. Niega uso de lentes de contacto. Examen: 
edema palpebral severo con quemosis conjuntival en ambos ojos, secreción purulenta abundante con ulceración corneal 
periférica inferior en ojo izquierdo, que compromete al tercio interno del estroma corneal. ¿Cuál de los siguientes se 
considera apropiado dentro del esquema de tratamiento para la patología más probable?",Inyección intraestromal de amfotericina,Tratamiento tópico con natamicina,Tratamiento sistémico con ceftriaxona,Inyección intravítrea de clindamicina,Tratamiento tópico con aciclovir,C
"¿Cuál es la sustancia que se usa en la vitrectomía para el reflotamiento a la cámara anterior de fragmentos del cristalino 
o lente intraocular luxados a la cavidad vítrea?",Aceite de silicona,Hexafluoruro de azufre,Perfluorocarbono liquido,Perfluoroetano,Perfluoropropano,C
"Niña de 4 años con baja visión en ojo izquierdo. Examen: agudeza visual de ojo derecho 20/30 y en ojo izquierdo 20/200. 
Refracción con cicloplejia: OD emétrope, OI hipermétrope de +3.00D. Segmento anterior y fondo de ojo normales en 
ambos ojos. Presión intraocular 10 mmHg en ambos ojos. No se evidencia estrabismo manifiesto. Se le indican gafas 
correctoras. ¿Cuál es la opción terapéutica más adecuada para estimular la visión del ojo izquierdo?",Atropina tópica en el ojo izquierdo,Toxina botulínica en recto medial de ojo izquierdo,Cirugía refractiva de ojo izquierdo,Terapia de oclusión en el ojo derecho,Cross linking de ojo izquierdo,D
El......es el tumor de nervios periféricos primario más común en la órbita.,meningioma del nervio óptico,astrocitoma,glioma del nervio óptico,neurofibroma plexiforme,oligodendroglioma,D
"¿Cuál de los siguientes es el síndrome que presenta vasculitis sistémica con inflamación intraocular y disfunción 
vestíbuloauditiva?",Stickler,Meige,Cogan,Lowe,Rieger,C
"En el ensayo clínico AREDS 2 sobre suplementos de antioxidantes en la degeneración macular asociada a la edad, se 
fundamenta el retiro de los betacarotenos y se agrega la luteína y zeaxantina. ¿Cuál es la patología cuyo riesgo de 
presentación se incrementaba con la ingesta de betacarotenos?",Cirrosis hepática en alcohólicos,Melanoma maligno en raza blanca,Cáncer de páncreas en diabéticos,Infarto de miocardio en obesos,Cáncer de pulmón en fumadores,E
"Varón de 25 años, con altos niveles de estrés, con disminución aguda de visión y metamorfopsias en ojo izquierdo. 
Antecedente de infección por Helicobacter pylori e ingesta crónica de corticoides por secuela de infección por SARS CoV-
2. Examen: agudeza visual en OD: 20/20, en OI: 20/70 que mejora con lentes positivos. Segmento anterior y presión 
intraocular normales. Fondo de ojo: lesión circular elevada en región macular y tomografía de coherencia óptica que 
reporta desprendimiento de retina neurosensorial en dicha región. ¿Cuál es la conducta terapéutica más adecuada?",Vitreólisis farmacológica con ocriplasmina,Vitrectomía por pars plana,Extracción quirúrgica de la membrana limitante,Suspender el tratamiento con corticoides,Panfotocoagulación retinal con láser argón,D
"Mujer de 44 años, que desde hace 3 años presenta fotofobia, ardor, enrojecimiento y secreción mucoide de ambos ojos. 
Antecedente de insomnio, pérdida de peso a pesar de polifagia, nerviosismo, piel sudorosa y temblor en las manos. 
Examen: exoftalmos bilateral. Córnea en ambos ojos con filamentos corneales de moco, mezclados con epitelio que se 
unen por un extremo a la superficie corneal, asociados a lesión conjuntival sectorial que se tiñe bien con rosa de bengala. 
¿Cuál es la enfermedad más probable?",Herpes zoster oftálmico,Queratopatía verticilata,Dacriocistitis crónica,Queratoconjuntivitis epidémica,Queratoconjuntivitis límbica superior,E
