questions,option_A,option_B,option_C,option_D,option_E,correct_answer
"Varón con antecedente de sinusitis no tratada, fiebre y cefalea. RMN cerebro: T1 región focal de señal hipointensa a 
intermedia; T2 señal intermedia a hiperintensa; refuerzo ausente en imágenes con contraste. ¿Cuál es el diagnóstico más 
probable?",Tuberculoma,Absceso micótico,Linfoma,Cerebelitis,Absceso piógeno,D
"Mujer de 63 años, asintomática. Mamografía: en ambas mamas calcificaciones lineales gruesas de distribución ductal, 
algunas con centro radiolúcido. ¿Qué categoría BIRADS se le asigna?",3,4a,5,4b,2,E
