questions,option_A,option_B,option_C,option_D,correct_answer
"Niño de 4 años con escasa interacción social, mal contacto visual, falta de reciprocidad del contacto social, indiferencia 
hacia los juegos o manifestaciones emocionales de otros niños, lenguaje estereotipado, adherencia a rutinas invariables, 
manierismos, ausencia de juego simbólico e hiperreactividad ante los ruidos. Antecedentes: nacido de parto eutócico, sin 
complicaciones. ¿Cuál es el diagnóstico más probable?",Autismo,Sordera,Retardo,Psicosis,A
"Los trabajadores de salud se sienten aislados y estigmatizados durante las pandemias, con riesgo de desarrollar trastorno 
de estrés postraumático. ¿Cuál de las siguientes medidas es un importante predictor negativo de la aparición de dicho 
trastorno?",Profilaxia con antidepresivos,Uso de hipnóticos,Soporte de jefes y colegas,Refuerzo vitamínico,C
"¿Cuál es el trastorno de personalidad caracterizado por frialdad emocional, ausencia de relaciones sociales, tendencia a 
la fantasía, las actividades solitarias y la introspección, con incapacidad para expresar sentimientos y sentir placer?",Compulsivo,Ansioso,Esquizoide,Delirante,C
¿Cuál es la comorbilidad más frecuente de bulimia nerviosa?,Manía,Depresión,Pánico,Alcoholismo,B
"Varón de 47 años en tratamiento por depresión con fatiga y astenia. Se presentó a la consulta con insomnio; este no 
cedía al uso de hipnóticos indicados por su psiquiatra. Examen: edema e hipotonía muscular. El paciente confesó que 
usaba un ""suplemento natural"" que creía inofensivo. ¿Cuál es la planta responsable, con mayor probabilidad?",Ginseng,Pasiflora,Manzanilla,Hoja de fresa,A
En el abuso de esteroides anabolizantes androgénicos. ¿Cuál es el trastorno comórbido más frecuente?,Dismórfico corporal,Ansiedad generalizada,Explosivo intermitente,Personalidad antisocial,A
¿Cuál es el área cortical del cerebro implicada en el trastorno por déficit de atención e hiperactividad?,Prefrontal,Hipocampal,Occipital,Parietal,A
¿Cuál es el mecanismo de defensa más utilizado por las personas con un trastorno de personalidad límite?,Formación reactiva,Anticipación,Desplazamiento,Identificación proyectiva,D
"En la visita del pabellón de pediatría se observó que un niño juega a los médicos y practica con un muñeco la inyección 
que él recibe todos los días en la mañana. ¿Cuál es el tipo más probable de conducta, entre las siguientes?",Imaginación,Agresión,Venganza,Contrafóbica,D
De los siguientes. ¿Cuál es el sistema esencial en la creación del deseo y placer en la respuesta sexual humana?,Serotoninérgico,Reticular,Hipotalámico,Dopaminérgico,D
"¿Cuál es la droga de consumo que es llamada ""anestésico disociativo"" porque produce un estado en el que los individuos 
están conscientes, pero aparentemente insensibles o disociados del entorno?",Cocaína,Propofol,Fenciclidina,Piperita,C
"Varón de 78 años, hipertenso, con antecedentes de microinfartos en región frontal, que se queja de sensibilidad emocional 
con cambio inestable y rápido de las emociones. ¿Cómo se denomina el síntoma?",Sensibilidad afectiva,Labilidad emocional,Letología,Hipomanía,B
"Mujer de 32 años, se despierta en la noche con la sensación de que hay un intruso en la casa; pero no puede moverse 
ni gritar en ese momento para alertar al esposo, quien niega la presencia extraña. ¿Cuál es el trastorno más probable?",Pesadillas,Alucinosis,Parálisis del sueño,Del comportamiento,C
"Varón de 18 años que siempre tuvo dificultades escolares. Es incapaz de captar los aspectos esenciales de un todo, para 
dividir un conjunto en sus partes y para discernir las propiedades comunes. Se sospecha de un retardo mental con un 
déficit del pensamiento...",integrador.,abstracto.,semántico.,lógico.,B
¿Cuál de los siguientes es el mecanismo clásico de adquisición de las fobias?,Condicionamiento operante,Condicionamiento pavloviano,Aprendizaje vicario,Aprendizaje traumático,B
"Mujer de 66 años, en psicoterapia por psicólogo desde hace 6 meses por depresión, con mejoría discreta. Desde hace 
10 meses se ha sentido triste, distraída, desanimada, con enlentecimiento psicomotor, sensación de intolerancia al frío. 
Examen: piel y cabello secos, obesidad central, edema en miembros inferiores y facies abotagada. ¿Cuál es el diagnóstico 
más probable?",Diabetes mellitus,Hipotiroidismo,Depresión refractaria,Fibromialgia,B
