questions,option_A,option_B,option_C,option_D,correct_answer
"Niña de 5 años traída por madre por ""micción involuntaria nocturna"", en ausencia de patología nefro/urológica ó 
neurológica, se plantea el diagnóstico de enuresis. ¿Cuál es el tratamiento inicial?",Oxibutina,Acetato de desmopresina,Motivacional,Imiprimina,C
"Niño de 6 años, presenta hace 7 días cefalea, rinorrea mucopurulenta y tos persistente que se intensifica al correr. 
Antecedente: rinitis alérgica con corticoides intranasales en 3 episodios similares al año. Examen: T° 36.5 °C, FC 85 X´; 
secreción purulenta en rinofaringe posterior; resto no contributorio. ¿Cuál es el examen diagnóstico de elección?",Radiografía,Tomografía,Microbiología,Serología,A
"Niño de 3 años, traído a control; madre refiere que en el último año, ha tenido 3 episodios de sibilancia, el último hace un 
mes. Antecedentes: niño portador de rinitis alérgica y sibilancias que no tienen relación con resfriado. Examen: T° 36.5 
°C, FC 80 X', FR 20 X', BEG; TyP: MV pasa bien en ACP, no ruidos agregados; resto sin anormalidades. ¿Cuál es el 
diagnóstico más probable?",Fibrosis quística,Asma bronquial,Síndrome de hiperreactividad bronquial,Enfermedad intersticial crónica,B
"¿Cuál es la enfermedad autoinmunitaria, inflamatoria y crónica caracterizada por la infiltración celular linfocítica y 
plasmática progresiva de las glándulas exocrinas, especialmente de las salivales y las lacrimales, con posibles 
manifestaciones sistémicas?",Parotiditis juvenil recidivante,Parotiditis infecciosa,Sarcoidosis,Síndrome de Sjögren,D
¿Cuáles son los senos paranasales presentes al nacimiento y que se encuentran neumatizados?,Maxilares,Esfenoidales,Frontales,Etmoidales,D
"Niño de 7 años procedente de Iquitos, consulta por presentar dolor abdominal intermitente, diarrea y síndrome de mala 
absorción. Examen: lesiones cutáneas pruriginosas y migratorias en región perianal, nalgas y parte superior de los 
muslos. ¿Cuál es el tratamiento de elección?",Ivermectina,Mebendazol,Pamoato de pirantel,Albendazole,A
"Niña de 10 años, desde hace 3 meses con dolor articular en forma intermitente, rigidez articular matutina que cede durante 
el día, hace 4 días cansancio, sueño alterado y alza térmica no cuantificada que cede con antipiréticos. Examen: FC 120 
X', FR 30 X', T° 38 °C; aumento de volumen de rodilla derecha con disminución del rango articular; resto de examen 
normal. ¿Cuál es el diagnóstico más probable?",Artritis idiopática juvenil,Lupus eritematoso sistémico,Fiebre reumática aguda,Artritis reactiva,A
"Niña de 6 años, es traída por ingesta accidental de paracetamol, ocurrido hace 4 horas; se concluye sobredosis. ¿Cuál 
es el tratamiento que debe recibir?",Carbón activado,N-acetilcisteína,Naloxona,Glucagón,B
"Pre-escolar de 3 años, desde hace 2 días presenta cojera y dolor a la movilidad de cadera derecha, niega otras molestias. 
Antecedentes: hace 7 días proceso infeccioso respiratorio alto de remisión espontánea. ¿Cuál es su diagnóstico?",Artritis séptica de cadera,Enfermedad de Perthes,Luxación de cadera,Tenosinovitis reactiva de cadera,D
En el síndrome congénito por el virus Zika. ¿Cuál es el sistema más frecuentemente afectado?,Cardiovascular,Nervioso central,Gastrointestinal,Locomotor,B
"Niño de 8 años con 3 semanas de dolor en extremidades inferiores, fiebre intermitente y pérdida de peso. Examen: FC 
100 X', FR 22 X', T° 38 °C, peso 22 Kg, pálido, adelgazado, adenopatías generalizadas. Tórax: MV en AHT; abdomen: 
hepatoesplenomegalia; MMII: no signos de flogosis, dolor a la dígito presión. Laboratorio: leucocitos 40000/µl, neutrófilos 
15%, plaquetas 50000/µl, Hb 7 g/dl. DHL elevada. ¿Cuál es el diagnóstico probable?",Leucemia,Aplasia medular,Linfoma,Trombocitopenia autoinmune,A
"¿Cuál es el agente causal de infecciones respiratorias altas y bajas, faringitis, gastroenteritis y característicamente cistitis 
hemorrágica?",Rinovirus,Metapneumovirus,Virus respiratorio sincitial,Adenovirus,D
¿Cuál es la presentación clínica más frecuente de la candidiasis en niños infectados de VIH?,Candidiasis atrófica,Candidiasis hiperplásica crónica,Muguet oral,Queilitis angular,C
"Según la guía de Vigilancia del Neurodesarrollo del niño, en relación al área cognitiva. ¿A qué edad en meses logra 
obedecer dos órdenes seguidas u órdenes de dos pasos?",24,21,30,18,C
"Neonato prematuro de 2 horas, presenta letargia, hipoactividad, irritabilidad y convulsión. Hemoglucotest: 60 mg/dl. ¿Cuál 
es la prueba más recomendada para confirmar el diagnóstico?",RM cerebral,Ecografía transfontanelar,TC cerebral,Angiografía cerebral,B
¿Cuál es la causa más frecuente de estreñimiento en niños?,Orgánica,Fármacos,Funcional,Malformación anatómica,C
"Niño de 3 años, desde hace 2 semanas con edema palpebral y dolor abdominal. Examen: PA normal, FC 80 X', FR 20 
X'; edema con fovea en miembros inferiores y genitales. Se sospecha en síndrome nefrótico de cambios mínimos. ¿Qué 
análisis confirmaría su diagnóstico?",Proteinuria 1+ ó 2+,Albumina sérica >2.5 g/dl,Cociente proteína/creatinina en orina >2,Creatinina sérica disminuida,C
¿Cuál es el método diagnóstico de broncomalacia o traqueomalacia?,Broncoscopía flexible o rígida,Radiografía de tórax,RM,TC,A
"Pre-escolar de 18 meses referido de centro de Nivel II con diagnóstico de insuficiencia respiratoria secundaria a 
bronquiolitis que no responde a tratamiento convencional. Antecedente: madre refiere que niña estaba ""previamente 
sana"". Examen: FC 80 X'; FR 40 X',SatO2 90%; hipoactiva, glasgow 8, respiración irregular en nebulización continua con 
gran movilización de secreciones; pupilas puntiformes poco reactivas; piel húmeda, llenado capilar 2"". TyP: subcrepitantes 
difusos ACP; resto no contributorio. ¿Cuál es el diagnóstico más probable?",Bronquiolitis aguda,Bronquiolitis obliterante,Intoxicación por órganofosforados,Estado asmático,C
"Adolescente de 14 años, acude por presentar cambio de coloración de las uñas de los pies. Examen de pies: uñas 
amarillentas, gruesas, quebradizas y levantadas; descamación y pápulas en espacios interdigitales. ¿Cuál es el 
diagnóstico más probable?",Psoriasis,Tiña de uñas,Liquen plano,Traquioniquia,B
"Ante la confirmación de pubertad precoz y habiendo descartado lesión de SNC. Se administra leuprolida de 0.2-0.3 mg/Kg 
mensual. ¿En cuántos meses de tratamiento se verá la eficacia terapéutica?",6,3,9,12,A
"Niño de 5 años con dos semanas de diarrea, dolor abdominal y pérdida de peso. Desde hace dos meses acude a 
guardería. Examen: BEG, REN, BEH. Abdomen: blando con dolor difuso y discreto a la palpación, no masas, RHA 
incrementados. Coprológico funcional: Sudan III (+++), glucosa (-), heces no formadas, moco (-), sangre (-). ¿Cuál es el 
agente etiológico?",Campylobacter sp,Giardia lamblia,Helicobacter pilori,Balantidium coli,B
"Niño de 4 años, presenta intolerancia al esfuerzo físico, pero mitiga la dificultad respiratoria cuando se sienta en cuclillas. 
Examen: T° 36.8 °C, FC 100X', FR 26X'; piel cianótica; CV: soplo holosistólico intenso precedido de un chasquido. Rx 
tórax AP: base estrecha del corazón, concavidad del borde cardiaco izquierdo y tamaño del corazón normal, corazón en 
forma de bota. ¿Cuál es el diagnóstico más probable?",Atresia tricuspídea,Tetralogía de Fallot,Transposición de grandes vasos,Anomalía de Ebstein,B
"Recién nacido a término de 6 horas, producto de parto precipitado, con inicio precoz de taquipnea y tiraje subcostal leve. 
Examen: T° 36.8 °C, FC 140 X', FR 60 X'; BEG; adecuada respuesta a estímulos; TyP: murmullo vesicular pasa bien en 
ACP, no ruidos agregados. Rx tórax: trama vascular perihiliar prominente y líquido en cisuras intralobares. ¿Cuál es el 
diagnóstico más probable?",Taquipnea transitoria del recién nacido,Neumonía neonatal,Enfermedad de membrana hialina,Aspiración meconial,A
