questions,option_A,option_B,option_C,option_D,correct_answer
"La diarrea crónica se define con una duración de ..... semanas, con volumen de heces mayor de ...... g/Kg/día en lactantes 
y pre escolares; mayor de ..... g/día en escolares.",4/20/200,4/10/200,4/10/300,4/15/250,B
"Niño de 5 años, traído al centro de salud por presentar desde hace 5 días dolor abdominal tipo cólico y diarrea, afebril. 
Desde hace 2 días la diarrea es sanguinolenta y el dolor abdominal ha empeorado; las heces son voluminosas. Examen: 
T° 37 °C, FC 110 X', FR 22 X'; mucosas con humedad disminuida; abdomen: blando, depresible, no visceromegalia, RHA 
incrementados; resto sin alteraciones. ¿Cuál es el agente etiológico?",Shiguella,Escherichia coli productora de toxina Shiga,Escherichia coli entero invasiva,Campylobacter,B
"Adolescente de 15 años, consulta por fiebre de 7 días, decaimiento, pérdida de peso y dolor articular. Antecedentes: hace 
un año presentó cuadro similar. Examen: T° 37.8 °C, FC 100 X', FR 24 X'; aftas bucal y nasal; fondo de ojo: vasculitis 
retiniana; Tórax y CV: normales; abdomen: hepatoesplenomegalia; SOMA: tumefacción rodillas y tobillos; neurológico: 
normal. ¿Cuál es el diagnóstico más probable?",Lupus eritematoso sistémico,Artritis idiopática juvenil,Leucemia,Linfoma,A
"En el niño menor de 2 años, que está siendo evaluado por la probabilidad de asma. ¿Cuál es la prueba de función 
pulmonar más utilizada?",Compresión rápida tóraco-abdominal,Espirometría,Pletismografía,Oscilometría de impulsos,A
"Niña de 18 meses, hace una semana recibió curso de antibióticos orales por diarrea aguda infecciosa; madre consulta 
por lesiones a nivel perineal que no mejoran con cremas de óxido de zinc. Examen de región perineal: exantema 
eritematoso confluente con pústulas satélites. ¿Cuál es el tratamiento tópico de elección?",Terbinafina,Tacrolimús,Betametasona,Clotrimazol,D
¿Cuál es la complicación más frecuente de la parotiditis?,Conjuntivitis,Pancreatitis,Meningoencefalitis,Trombocitopenia,C
"La muerte cerebral en pacientes pediátricos es el cese irreversible de todas las funciones del cerebro en su conjunto, 
incluido...",el tronco encefálico.,el cerebelo.,paro cardiorespiratorio.,paraplejia.,A
"Escolar de 12 años acude a emergencia por presentar dolor abdominal intenso y alza térmica; antecedente de varicela 
hace 10 días. Examen: FC 120 X', FR 30 X', T° 39 °C, despierto, facies dolorosa, con múltiples lesiones costrosas en 
superficie corporal y huellas de rascado; abdomen: eritema marcado que abarca hipogastrio y mesogastrio con dolor 
intenso a la palpación; GU sin alteraciones. ¿Cuál es el diagnóstico más probable?",Celulitis,Apendicitis Aguda,Mionecrosis,Fascitis necrosante,D
"Niña de 2 años, presenta fiebre alta, dolor intenso de garganta, tos seca, secreción nasal. Examen: T° 39 °C, FC 130 X', 
FR 30 X'; tos seca, secreción nasal transparente, úlceras en faringe, ganglios cervicales con leve aumento de tamaño; 
resto sin anormalidades. ¿Cuál es el diagnóstico más probable?",Faringitis estreptocócica,Mononucleosis infecciosa,Faringitis herpética,Herpangina,D
¿Cuál es la consecuencia más grave de la hipernatremia severa no tratada?,Mielinólisis pontina,Epilepsia estructural,Hemorragia cerebral,Hidrocefalia comunicante,C
"Adolescente de 13 años acude solo a la Estrategia Sanitaria de Prevención y Control de ITS-VIH; el especialista indica 
prueba para tamizaje VIH. ¿Cuál es la conducta inmediata a seguir?",Tomar la prueba y luego solicitar presencia de padres/tutor,Si la prueba es positiva solicitar presencia de padres/tutor,Brindar consejería post test al adolescente,Solicitar presencia de padres/tutor previo a la prueba,D
"Niño de 5 años, conducido a emergencia por haber sufrido quemadura que ha comprometido toda la epidermis y parte 
de la dermis. ¿A qué grado de quemadura corresponde?",Primer grado,Segundo grado,Tercer grado,Indeterminado,B
¿Cuál es el tipo de leucemia más frecuente en la edad pediátrica?,mieloide aguda,mieloide crónica,linfoblástica aguda,promielocitica aguda,C
"Niño de 2 años previamente sano, es traído a emergencia por presentar tos paroxística y nausea. Examen: T° 36.5 °C, 
FR 50 X', FC 100 X', SatO2 92%; sibilantes en hemitórax derecho. ¿Cuál es el diagnóstico más probable?",Bronquiolitis,Laringotraqueítis aguda,Cuerpo extraño en vía aérea,Crisis asmática,C
"En la evaluación terciaria de una crisis hipertensiva, la primera intervención terapéutica es...",establecer la gravedad.,excluir otras causas de hipertensión.,confirmar la presión arterial elevada.,administración de hipotensores intravenosos.,C
"Niña de 13 años, desde hace dos meses debilidad en extremidades inferiores y dificultad para caminar; hace 
dos semanas se agregan náusea y vómitos. Antecedente: migraña medicada por la madre con antimigrañosos. 
Examen: fuerza muscular disminuida; sensibilidad, tono y ROT normales; cianosis intensa en pies que desaparece al 
decúbito. Laboratorio: CPK, DHL y electrolitos normales. Electromiografía normal. ¿Cuál es el diagnóstico más probable?",Somatismo,Ergotismo,Guillain Barré,Mielitis transversa,B
¿Qué espera encontrar en la dermatitis atópica?,Ampollas,Pliegues de Dennie-Morgan,Pliegue nasal transverso,Queratosis pilar,B
"Niña de 9 años, es traída por la madre para hacer evaluación del desarrollo puberal, ya que está preocupada porque ve 
a sus compañeras de colegio ""más desarrolladas"". Examen de mamas, vello púbico, genitales y corporal: etapa 1. ¿Cuál 
es la recomendación a la madre?",Esperar y control posterior,Solicitar pruebas de laboratorio,Solicitar estudios de imágenes,Hospitalización y tratamiento,A
"RN de una hora de vida, parto domiciliario, 33 semanas de EG, es llevado a emergencia. Examen: FC 180 X', FR 80 X', 
SatO2 86 %, presenta aleteo nasal, cianosis, retracciones supraesternales e intercostales, quejido audible y taquipnea. 
Rx tórax: microatelectasias homogéneas y broncogramas aéreos. ¿Cuál es el diagnóstico?",Taquipnea transitoria del recién nacido,Síndrome de dificultad respiratoria,Neumonía neonatal,Displasia broncopulmonar,B
"Adolescente de 12 años referido de Provincia con el diagnóstico de desnutrición severa, tuberculosis e HTA; refiere 
tratamiento de TB curso completo sin mejoría de síntomas respiratorios. Ampliación anamnésica: paciente con disfagia y 
pirosis, refiere coloración azulada en dedos de manos al frío, cansancio al esfuerzo físico. Examen: despierta conectada 
con entorno, dificultad para la deambulación, facie características, piel endurecida y seca a predominio de articulaciones 
metacarpofalangicas y metatarsofalangicas, úlceras en las puntas dedos de las manos. ¿Cuál es la sospecha 
diagnostica?",Esclerodermia Sistemica,Tuberculosis MDR,Desnutrición severa.,Dermatomiosistis juvenil,A
¿Cuál es el medicamento que induce o desencadena LES?,Salicilato,Minociclina,Furosemida,Fluconazol,B
"Lactante de un mes, traído a urgencias por episodios de palidez marcada intermitente, respiración muy pausada 
acompañada de flacidez de corta duración. Antecedentes de prematuridad, EG al nacer 32 semanas. Examen: FC 130 
X', FR 40 X', SatO2 98%; reactivo al estímulo táctil y succión vigorosa. Según su diagnóstico. ¿Cuál es la conducta a 
seguir?",Monitorización por 4 horas,Cobertura antibiótica,Alta y consejería a cuidadores,Hospitalización y estudio,D
"Niño de 6 años, desde hace 10 días presenta fiebre, cefalea, irritabilidad, somnolencia y malestar general; hace dos 
días vómitos. Examen: T° 38.5°, FC 100 X´, FR 24 X´, nauseoso, somnoliento, irritable, disártrico; neurológico: signos de 
Kernig (+) y Brudzinsky (+). Laboratorio: LCR: 400 leucocitos/µl a predominio de linfocitos, Proteínas 2000 mg/dl, Glucosa 
<40 mg/dl. ¿Cuál es el diagnóstico más probable?",MEC bacteriana,MEC viral,MEC TB,Meningitis eosinofílica,C
"Enfermedad sistémica, inflamatoria, febril aguda, que se manifiesta en forma de vasculitis y que afecta principalmente a 
las arterias coronarias; es la principal causa de cardiopatía adquirida en los niños en la mayoría de países desarrollados. 
¿Cuál es el diagnóstico?",Fiebre reumática,Artritis idiopática juvenil,Lupus eritematoso sistémico,Enfermedad de Kawasaki,D
"Lactante de 4 meses, es llevado a control de niño sano. Examen: Ortolani y Barlow dudosos en cadera derecha, pliegues 
simétricos. ¿Cuál es la conducta a seguir?",Solicitar radiografía,Colocar arnés de Pavlik,Solicitar ecografía,Colocar triple pañal,C
"Niño de 18 meses, presenta erupción eritematosa macular difusa que inició en cara dando aspecto de ""mejillas 
abofeteadas"", extendida al tronco y parte proximal de las extremidades y que progresivamente dan un aspecto reticulado 
en encaje, respetando palmas y plantas. ¿Cuál es el agente causal más probable?",Paramixovirus,Herpes virus 6,Herpes Zoster,Parvovirus B19,D
"Lactante de 07 meses, traída a emergencia por llanto excesivo y fiebre. Desde hace una semana presenta congestión 
nasal y tos leve. Antecedente de lactancia mixta. Examen: faringe eritematosa sin placas purulentas, en oído derecho 
membrana timpánica congestiva y abombada. ¿Cuál es el tipo de otitis que presenta?",Externa,Media crónica,Interna,Media aguda,D
"¿Cuál es la indicación para la alimentación de un recién nacido de madre con TB pulmonar en tratamiento de esquema 
sensible?",Sucedáneos de la leche materna sin protección respiratoria,Lactancia materna indirecta por extracción manual,Lactancia materna exclusiva con protección respiratoria,Inicio de alimentación complementaria,C
"Recién nacido de 4 semanas, presenta dificultad respiratoria persistente, requiriendo oxígeno suplementario con soporte 
no invasivo de presión positiva. Antecedente: nacido de 28 semanas de EG. Examen: T° 37 °C, FC 150X', FR 60 X', 
SatO2 94% (con O2); TyP: tiraje intercostal y subcostal. Rx tórax: hiperinsuflación relativa con opacidades intersticiales 
difusas y finas. ¿Cuál es el diagnóstico más probable?",Displasia broncopulmonar,Sepsis precoz,Enfermedad de membrana hialina,Neumonía neonatal,A
"Niño de 8 años traído por trauma ocular jugando futbol, presenta visión borrosa, disminución de la apertura ocular y leve 
lagrimeo. ¿Cuál es la primera posibilidad diagnóstica?",Glaucoma secundario,Retinoblastoma,Catarata traumática,Desprendimiento de retina,D
"La posibilidad de que un recién nacido de 32 a 36 semanas de EG desarrolle síndrome de dificultad respiratoria 
(enfermedad de la membrana hialina) es del...",15-30%.,60-80%.,40-50%.,<5%.,A
"Niña de 4 años, presenta intolerancia a la luz y dificultad en la visión nocturna. Examen: T° 36.5 °C, FC 80 X', FR 22 X'; 
en la membrana conjuntival se observan Manchas de Bitot; resto sin alteraciones. ¿La deficiencia de qué vitamina produce 
este cuadro?",C,B12,B6,A,D
"Lactante de 4 meses cuya madre solicita transferencia al cardiólogo porque el padre tiene cardiopatía congénita. Examen: 
FC 100 X', FR 28 X', peso 5 kg, talla 54 cm. MV presente en AHT; CV: ruidos cardiacos de buena intensidad en 
mesocardio, R2 desdoblado y fijo durante todas las fases de la respiración, se escucha mejor en el borde esternal superior. 
¿Cuál es el diagnóstico más probable?",Comunicación interventricular,Coartación de aorta,Comunicación interauricular,Ductus arterioso,C
"Lactante de 4 meses de edad; nacida a término con peso adecuado. ¿Hasta qué edad en meses deberá recibir 2 
mg/Kg/día de sulfato ferroso?",5,6,11,12,B
"Niña de 10 años, es traída por madre quien refiere que desde hace 2 meses tiene alteración de la alimentación ""no quiere 
comer y observa mucho la cantidad de calorías"", además dice que ""esta gorda"". Al momento de la evaluación le dice al 
médico que debe tener cuidado con el número de calorías que contiene la botella de agua. Examen: IMC 16; adelgazada, 
pálida. ¿Cuál es el diagnóstico más probable?",Bulimia nerviosa,Trastorno por evitación,Anorexia nerviosa,Depresión severa,C
"Neonato traído a emergencia, por lactancia entrecortada con succión débil progresiva y respiración rápida. Examen: FC 
158 X', FR 70 X', SatO2 90%; peso: 3,200 g; se palpa hígado a 3 cm DRCD, se ausculta soplo sistólico en mesocardio. 
¿En qué diagnóstico sospecha?",Neumonía comunitaria,Insuficiencia cardiaca,Taquipnea transitoria,Sepsis neonatal,B
"Niño de 10 años, desde hace 7 días presenta tos seca irritativa, cefalea, se agrega fiebre y taquipnea. Examen: FR 50 X', 
FC 85 X', T° 38.8 °C; tórax: MV pasa disminuido en HTI, algunos sibilantes en AHT, crépitos en HTI y tirajes intercostales. 
¿Cuál es el diagnóstico?",Crisis asmática,Atelectasia,Neumonía atípica,Bronquitis aguda,C
"Niño de 10 años en programa de hemodiálisis por ERC, presenta súbitamente dolor intenso a nivel torácico, se confirma 
embolia pulmonar. ¿Cuál es el tratamiento inicial?",Warfarina,Enoxaparina,Heparina no fraccionada,Vitamina K,C
"Niño de 4 años, traído al centro de salud por presentar fiebre, secreción nasal y tos seca. Examen: T° 38 °C, FC 90 X', 
FR 24 X'; se evidencia secreción nasal transparente, faringe congestiva, tos seca disfónica; resto sin alteraciones. ¿Cuál 
es el diagnóstico más probable?",Faringoamigdalitis aguda,Traqueitis aguda,Traqueobronquitis aguda,Laringitis aguda,D
"Niño de un año, traído por presentar fiebre, irritabilidad y lesión de piel en brazo derecho. Examen: T° 38 °C, FC 100 X', 
FR 24X'; Piel: lesión eritematosa, edematosa, caliente y dolorosa de aproximadamente 5 cm, de bordes mal definidos y 
que al presionar aparece fovea, localizada en brazo derecho; adenopatía axilar derecha. Resto sin anormalidades. ¿Cuál 
es el diagnóstico más probable?",Impétigo no ampolloso,Celulitis,Síndrome de Skeeter,Ectima,B
"Niño de 10 años, con diagnóstico de asma bronquial alérgica desde hace varios años, con tratamiento controlador. En 
los últimos 8 meses ha presentado 3 episodios de exacerbación, por lo cual, en las últimas 8 semanas ha recibido GCI a 
dosis alta + LAB",Antileucotrieno,Teofilina de acción prolongada,Corticoide sistémico,Omalizumab,D
"Adolescente de 14 años, procedente de AAHH, desde hace un mes dolor abdominal que no calma con la ingesta de 
alimentos, pérdida de peso y náusea, se agrega vómitos desde ayer. Funciones biológicas: apetito disminuido; heces 
normales. Examen: palidez; abdomen: distendido, RHA ++, doloroso. ¿Cuál es el diagnóstico más probable?",Gastritis por H. pylori,Enfermedad de Crohn,Úlcera péptica,Reflujo gastroesofágico,A
"Lactante de 4 meses con estridor inspiratorio de tono bajo, que se intensifica al llanto, agitación o alimentación. ¿Cuál es 
el diagnóstico más probable?",Laringomalacia,asma del lactante,Ingesta de cuerpo extraño,Bronquiolitis,A
"En un neonato con ductus arterioso permeable, con manejo de soporte general. En cita de control se evidencia que no 
hubo cierre del ducto y se decide administrar tratamiento con ibuprofeno. Se debe considerar que es efectivo si se 
administra antes de los ...... días de vida.",7,30,21,3,C
"Adolescente de 15 años, que súbitamente presenta cefalea intensa y náusea; al levantarse siente mareos y lateralización 
del cuerpo; al pedir ayuda para desplazarse no es entendida y presenta vómitos explosivos. Niega contusiones o caídas. 
¿Cuál es el examen de elección a solicitar?",Angiografía por RM,Angiografía por TC,RM encefálica,TC craneal,D
"Según el índice Predictivo de Asma, para plantear el diagnóstico probable de asma, tiene que ocurrir 3 o más episodios 
de sibilancias en el último año, más...",dos criterios mayores.,un criterio mayor y un criterio menor.,tres criterios menores.,un criterio mayor.,D
"Se notifica presencia de casos de VIH en los alumnos de una escuela de secundaria, el establecimiento de salud del 
ámbito considerará un programa de comunicación educativa en salud. ¿Cuál de las áreas o líneas de acción prioritarias 
de la carta de Ottawa se implementará?",Elaboración de una política pública sana,Reforzamiento de la acción comunitaria,Desarrollo de las aptitudes personales,Creación de ambientes favorables,C
"Escolar de 6 años con TE 10 días, fiebre intermitente, dolor a nivel de espalda que mejora al mantenerse rígido. Examen: 
contractura de músculos paravertebrales, dolor exquisito a la presión de apófisis espinosas lumbares. Laboratorio: 
reactantes de fase aguda elevados. Rx de columna: pérdida de lordosis lumbar. ¿Cuál es la indicación inmediata?",Antibióticos antiestafilocócicos empíricos,Terapia física,Biopsia con aguja del espacio discal guiada por TC,Resonancia magnética,A
"Niña de 12 meses que estando hospitalizada por cuadro febril, presenta súbitamente edema de labios, eritema y estridor 
post administración de metamizol EV. Respecto al tratamiento. ¿Cuál es el medicamento de primera línea?",Clorfenamina,Prednisolona,Cetirizina,Adrenalina,D
"¿Si la sospecha diagnóstica es Atresia de Duodeno, que signo se encuentra en una radiografía simple de abdomen?",Triple burbuja,Neumatosis intestinal,Distensión gástrica,Doble burbuja,D
"En un niño de 4 años de edad, cuya madre está en tratamiento TB esquema sensible menor a un mes. ¿Cómo se 
considera el  PPD de 7 mm?",Negativo,Positivo,Limítrofe,Confuso,B
"Niño de 7 años, hace 3 días con dolor de garganta y de cuello, fiebre, niega tos. Examen: T° 38.6 °C; boca: faringe 
eritematosa, hipertrofía de amígdalas con secreción blanquecina, petequias en paladar; adenopatías cervicales 
dolorosas. ¿Cuál es el diagnóstico más probable?",Rinofaringitis aguda,Amigdalitis purulenta,Faringitis estreptocócica,Herpangina,C
"La deficiencia de la vitamina ...... puede condicionar una hemorragia con repercusión clínica; afecta de forma característica 
a los lactantes que sufren una deficiencia transitoria en relación con una ingesta inadecuada.",E,niacina,biotina,K,D
"Pre-escolar de 4 años es referido de centro de salud por “caída desde el camarote” y pérdida de conocimiento, según 
madre “encontró a niña en el piso boca arriba e inconciente”. Examen: con apoyo ventilatorio invasivo, pupilas puntiformes 
poco reactivas; glasgow 7, no signos de focalización; múltiples equimosis y hematomas en distinto estadío de evolución 
en tronco, brazos y pelvis; GU: eritema perianal. ¿Cuál es la sospecha más probable?",TEC grave,Maltrato infantil,Estado post ictal,Intoxicación por órganofosforados,B
¿En qué caso NO está indicada la circuncisión?,Hipospadia,Fimosis,Prepucio redundante,Reflujo vesicoureteral,A
"En la evaluación del desarrollo del lenguaje, si un niño es capaz de construir frases de dos palabras. ¿A qué edad 
cronológica en meses corresponde?",18,12,15,24,D
¿Cuál es el germen causal más frecuente de la osteomielitis?,Staphylococcus aureus,Estreptococos del grupo A,Streptococcus pneumoniae,Kingella kingae,A
"Recién nacido de 14 días, presenta temperatura inestable, intolerancia a la alimentación y heces sanguinolentas. 
Antecedente: al nacer pesó 1500 g. Examen: T° 36 °C, FC 140 X', FR 30 X'; TyP: normal; CV: taquicardia sinusal; 
abdomen: distensión abdominal; neurológico: letargia leve. Rx abdomen: neumatosis intestinal. ¿Cuál es el diagnóstico 
probable?",Enterocolitis necrotizante,Sepsis neonatal,Vólvulo intestinal,Obstrucción gastro intestinal,A
"Niño de 10 años, con rinitis alérgica, es traído por presentar hace 12 días congestión nasal, fiebre y dolor facial; hasta la 
fecha ha presentado cuatro cuadros similares. Examen: secreción purulenta en cavidad nasal. ¿Cuál es el tratamiento de 
primera línea?",Amoxicilina/clavulanato,Claritromicina,Fluticasona intranasal,Loratadina,A
"Lactante de 12 meses, traído a emergencia por presentar desde hace 4 días rinorrea, tos exigente y fiebre. Examen: FC 
120 X', FR 46 X', SatO2 90%; Tórax: sibilantes en AHT, tirajes intercostales. ¿Cuál es el agente etiológico más frecuente?",Rinovirus,Parainfluenza,Virus sincitial respiratorio,Adenovirus,C
"Niño de 8 años, traído por presentar orina de color rojizo e hinchazón de párpados. Antecedente: hace 10 días tuvo un 
cuadro respiratorio faríngeo con fiebre. Examen: T° 36.8 °C, FC 80 X', FR 20 X', PA 150/90 mmHg; edema palpebral y 
en miembros inferiores; resto sin anormalidades. En la prueba de laboratorio se encuentra nivel bajo de C3. ¿Cuál es el 
diagnóstico?",Lupus eritematoso sistémico,Glomerulonefritis membrano proliferativa,Síndrome nefrítico agudo,Endocarditis aguda,C
"Niño de 7 años, hace 5 días sufre traumatismo dorso lumbar, seguido de dolor abdominal progresivo y 2 días después 
alza térmica. Examen: FC 90 X', FR 22 X', SatO2 99%, T° 39 °C; posición antálgica en decúbito dorsal, con miembro 
inferior izquierdo flexionado y en rotación interna. Laboratorio: leucocitosis con desviación izquierda, PCR: 40 mg/dl, 
sedimento de orina normal, hemocultivos negativos hasta el momento. RX de huesos largos normal. ¿Cuál es el examen 
diagnóstico de elección?",Ecografía abdominal,Tomografía abdominal contrastada,Radiografía de abdomen,FAST,B
"Adolescente que desde hace un año recibe tratamiento con fluoxetina y amitriptilina por cuadro ansioso depresivo. No 
otro antecedente. Presenta cuadro de agitación y verborrea. Examen: FC 120 X', FR 25 X', PA 130/100 mmHg. ¿A qué 
corresponde este cuadro?",Posible consumo de cocaína,Delirium tremens,Evento adverso serotoninérgico,Suspensión de la medicación,C
"Niño de 5 años, traído al centro de salud, por tener dolor de garganta leve, tos, fiebre, secreción nasal. Examen: T° 38.5 
°C axilar, FC 120 X', FR 30 X'; luce levemente decaído, se evidencia secreción nasal transparente y tos seca; faringe 
congestiva; ganglios cervicales pequeños; resto del examen no contributorio. ¿Cuál es el diagnóstico más probable?",Faringitis aguda viral,Faringitis estreptocócica,Faringitis a germen atípico,Mononucleosis infecciosa,A
"Lactante de 2 meses, desde hace 3 días presenta alza térmica, irritabilidad, pobre succión. Examen: T° 40 °C; llenado 
capilar >3"", FC: 180 X', FR 30 X'; sensorio alternante; extremidades frías; no hallazgos respiratorios. ¿Cuál es el 
diagnóstico más probable?",Neumonía complicada,Pielonefritis,Reacción post vacunal,Shock séptico,D
"Lactante de 6 meses, presenta reactividad cutánea y prurito intenso especialmente por la noche. Examen: T° 36.8 °C, 
FC 80 X', FR 22 X'; piel seca, pápulas eritematosas descamativas que afectan cara, cuero cabelludo y superficies 
extensoras de las extremidades, respetando el área del pañal. Según el diagnóstico. ¿Cuál es el tratamiento de 
primera línea?",Corticoides sistémicos,Corticoides tópicos,Hidratantes tópicos,Inhibidores tópicos de la calcineurina,C
"Niño de 8 años, procedente de Tumbes, es traído por presentar desde hace 3 semanas cefalea, hiporexia, fiebre, se 
agrega náusea y vómitos. Examen: T° 39 °C, FC 90 X', FR 24 X', PA 70/50 mmHg; palidez marcada, llenado capilar 3""; 
abdomen: hepatoesplenomegalia, doloroso a la palpación profunda. Laboratorio: resultado de gota gruesa 
describe trofozoito ameboide. ¿Qué tipo de plasmodium es?",Falciparum,Malariae,Ovale,Vívax,D
"Lactante de un mes de vida, presenta secreción ocular intermitente desde la segunda semana de vida. ¿Cuál es el 
diagnóstico?",Conjuntivitis bacteriana,Conjuntivitis alérgica,Dacrioestenosis,Dacriocistitis,C
¿Cuál es el anticonvulsivante de elección en el neonato?,Fenitoína,Fenobarbital,Diazepam,Topiramato,B
"Madre acude a consulta de CRED con su hijo de 5 meses, informa que abandono suplemento con las gotas de sulfato 
ferroso por estreñimiento y nausea; se verifica menos de 40% de consumo al mes. El valor de hemoglobina es normal. 
¿Qué se indicará?",Alimentos de origen animal,Medición de Hb a los 12 meses de edad,Hierro elemental 60 mg + 400 µg de ácido fólico,Complejo polimaltosado férrico,D
Se requiere aplicar vacuna BCG a recién nacido de madre portadora de VIH. ¿Cuál es el procedimiento a seguir?,Vacunar dentro de las primeras 24 horas,Evaluar recuento linfocitario de CD4 mayor o igual a 400,Solicitar vacunación por vía oral,Vacunar sólo si el niño está en estadío SIDA,B
"Escolar de 12 años con derivación ventrículo peritoneal por hidrocefalia congénita, consulta por cefalea intensa y vómitos 
que no ceden con analgésicos, niega fiebre. ¿Cuál es el primer diagnóstico a considerar?",Crisis de migraña,Disfunción valvular,Meningitis,Hemorragia intracraneal,B
"¿Cuál es el hallazgo frecuente en los recién nacidos prematuros, nacidos antes de las 28 semanas; que puede provocar 
una hipercirculación pulmonar, complicando el manejo de la enfermedad respiratoria (membrana hialina entre otros)?",Foramen oval permeable,Conducto arterioso persistente,Estenosis pulmonar leve,Comunicación interauricular pequeño,B
La muerte súbita del lactante se relaciona con la posición:,Decúbito supino,Decúbito lateral,Trendelenburg,Decúbito prono,D
"Adolescente, presenta vello pubiano en la base del pene que se extiende a región inguinal y se distribuye hacia la línea 
media de los muslos. Respecto a la clasificación de Desarrollo Puberal. ¿A qué grado corresponde?",V,III,IV,II,A
"Niño de 6 años, traído por presentar irritabilidad desde hace 6 horas sin causa aparente. Padres refieren haber encontrado 
abierto el botiquín de la casa. Antecedentes: padre hipertenso y madre diabética. Examen: T° 36.4 °C, FC 40 X', FR 24 
X', PA 50/30 mmHg; niño letárgico. ¿Cuál es el fármaco implicado en la intoxicación?",Sulfonilurea,Metformina,Beta-bloqueador,Meglitinida,C
