questions,option_A,option_B,option_C,option_D,option_E,correct_answer
"¿Cuál de los siguientes hallazgos histológicos es más probable que se encuentre en una muestra de 
apendicectomía de un paciente con antecedentes de ruptura de hace 4 semanas y posterior terapia con 
antibióticos?",Inflamación granulomatosa,Infiltrado inflamatorio eosinofílico,Criptitis,Hiperplasia linfoide,Periapendicitis,A
"Lactante de 6 meses con una tumoración intrarrenal macroscópicamente sólida y amarillenta. AP revela células 
fusiformes acompañadas por islotes de cartílagos y focos de hematopoyesis. ¿Cuál es el diagnóstico más 
probable?",Nefroma mesoblástico,Tumor rabdoide,Sarcoma de células claras,Tumor de Wilms,Neuroblastoma,A
"Niño de 5 años, la mama refiere que sufre de cefalea, ataxia y vómitos desde hace 3 semanas. En la TC de cráneo 
se observa masa en fosa posterior que emerge de la línea media del cerebro y alcanza el IV ventrículo. ¿Cuál es 
el diagnóstico más probable?",Craneofaringioma,Hemangioblastoma,Glioblastoma multiforme,Oligodendroglioma,Meduloblastoma,E
"¿Qué porcentaje de prolinfocitos en sangre periférica se requiere para un diagnóstico de leucemia prolinfocítica 
de células B?",10%,50%,55%,5%,90%,C
"Varón de 61 años con hematuria, TC tumor renal de localización piramidal central. AP revela arquitectura tubular 
irregular con alto grado nuclear y estroma desmoplásico. IHQ: reacción positiva para 34BE12, ULEX -1 y CK de 
bajo peso. Negatividad para CD10, AMACR, PAX-2. ¿Cuál es el diagnóstico más probable?",Carcinoma renal papilar,Carcinoma del conducto colector,Carcinoma,Carcinoma metastásico,Carcinoma de células renales sin clasificar,B
"¿Cuál es la dermatosis infecciosa que asemeja a una verruga plana, tiene ocurrencia familiar, con una herencia 
autosómica recesiva, puede sufrir cambios malignos generalmente hacia la enfermedad de Bowen, y en ocasiones, 
a carcinoma espinocelular?",Condiloma acuminado,Molusco contagioso,Exantemas virales,Granuloma anular,Epidermodisplasia verruciforme,E
"Mujer de 74 años, acude por presentar masa tumoral en la uretra desde hace 6 meses, le produce dolor local e 
irritación y en este momento sangra. Al examen masa verrucosa ulcerada de 2.5cm, que protruye desde el meato 
uretral externo. No se observa lesiones en labios mayores, menores ni en vagina. Se le toma biopsia. ¿Cuál es el 
diagnóstico más probable?",Rabdomiosarcoma embrionario,Leiomioma,Carcinoma epidermoide,Condilomas plano,Carcinoma de células claras,C
"¿Cuál es la fase de la mitosis en la cual las cromátides de cada cromosoma se separan y se dirigen hacia polos 
opuestos?",Metafase,Anafase,Profase,Prometafase,Telofase,B
"Niño de 12 años es llevado a emergencias por sus padres porque se queja de no poder ver correctamente. Al 
examen clínico muestra defectos temporales bilaterales en su campo visual. Una tomografía computarizada 
cerebral revela masa que tiene algo de calcificación. ¿Cuál es el diagnóstico más probable?",Meduloblastoma,Craneofaringioma,Ependimoma,Oligodendroglioma,Astrocitoma pilocítico,B
"En un paciente con diagnóstico de tumor carcinoide en pulmón. ¿Cuál de las siguientes manifestaciones cardíacas 
es más probable que se desarrolle como parte de una cardiopatía carcinoide?",Estenosis de la válvula aórtica,Estenosis de la válvula mitral,Insuficiencia de la válvula pulmonar,Insuficiencia de la válvula aórtica,Insuficiencia de la válvula tricúspide,E
"Un paciente de 53 años sufre un infarto agudo de miocardio. Se encuentra que tiene un alto nivel de inhibidor 
competitivo para la activación de plasmina. ¿Cuál es este inhibidor?",Lipoproteína (a),LDL oxidado,Metaloproteinasas,Proteína C reactiva,Homocisteína,A
"Mujer de 40 años, a la que se le realiza BAAF de nódulo tiroideo multilobulado con ecogenicidad heterogénea. La 
citología revela regular cantidad de linfocitos maduros pequeños sin atipia en fondo hemático, asociado a células 
foliculares, dispuestas en mantos pequeños que carecen de superposición nuclear; núcleos ovalados con bordes 
definidos de aspecto benigno, situados en espacios uniformes, asociado a la presencia de células de Hürtle y 
escaso coloide.  ¿Cuál es el diagnóstico más probable?",Enfermedad de Graves,Tiroiditis granulomatosa,Tiroiditis aguda,Tiroiditis de Hashimoto,Tiroiditis de Riedel,D
"Niño de 3 años con síndrome febril de etiología desconocida, linfadenopatía cervical, rash cutáneo eritematoso e 
inyección conjuntival. AP ganglionar reveló infartos en parches asociados a trombos de fibrina en vasos pequeños. 
¿Cuál es el diagnóstico más probable?",Toxoplasmosis,Mononucleosis infecciosa,Lupus eritematoso diseminado,Enfermedad de Behcet,Enfermedad de Kawasaki,E
¿Cuál es criterio diagnóstico de gammapatía monoclonal de significado indeterminado?,Hiperviscosidad,Infiltrado linfoplasmocítico en médula ósea <10%,Hepatoesplenomegalia,Concentración sérica de proteína monoclonal IgM >30 g/L,Anemia,B
"¿Cuál es la lesión ósea que produce un aumento de masa en forma desordenada y estructuralmente inapropiada, 
su hallazgo característico es el patrón en mosaico?",Osteítis deformante,Acondroplasia,Osteopetrosis,Displasia tanatofórica,Osteoma osteoide,A
"Cambios histológicos en bronquíolos caracterizados por  neumonía intersticial, granulomas caseificantes y fibrosis 
intersticial. ¿A qué patología corresponde?",Neumonía por hipersensibilidad,Daño alveolar difuso,Neumonía intersticial linfoide,Sarcoidosis,Neumonía intersticial habitual,A
"Varón 43 años, durante el último año, presentó diarrea intermitente, ocasionalmente sanguinolenta, y dolor 
abdominal, tuvo una variedad de diagnósticos, desde gastritis aguda hasta una supuesta diverticulosis. Durante 
este tiempo, ha perdido 7kg. Gastroenterólogo realiza enema de bario e identifica pared engrosada rígida con 
regiones estrechas del intestino grueso entremezcladas con regiones normales. ¿Qué lesión mostraría una biopsia 
del intestino grueso?",Ameba con glóbulos rojos engullidos,Granulomas no caseificantes,Abscesos y úlceras de las criptas,Glándulas neoplásicas invasoras,Necrosis coagulativa e infiltrado eosinofílicos,B
¿Cuál es característica de los macrófagos alveolares?,Se originan de neutrófilos de la sangre,Secretar alfa 1 antitripsina,Secretar elastasa,Secretar pequeñas cantidades de surfactante,Participar en la aparición de la enfermedad de,C
"El AP en la cirrosis hepática revela depósitos de la trama de reticulina con fibrosis en puentes secundario al 
depósito de colágeno en el espacio de Disse, con formaciones del tabique fibroso. ¿Cuál de las células se activa 
por influencia de las citosinas para convertirse en células productoras de colágeno?",Células del conducto biliar,Hepatocitos,Células estrelladas,Macrófagos,Célula endotelial,C
"Varón de 36 años, con ulcera a nivel de ciego. AP revela úlcera en forma de botella que se extiende a submucosa 
socavando la mucosa normal adyacente, en donde se observan células con núcleos pálidos redondos con 
citoplasma espumoso y contienen eritrocitos ingeridos que tiñen PAS y tricómica positivo.  ¿Cuál es el agente 
causal?",Entamoeba histolytica,Giardia lamblia,Leishmania,Balantidium coli,Cryptosporidium Parvum,A
"¿Cuál es la neoplasia maligna extracolónica más común que surge en el contexto de la poliposis adenomatosa 
familiar?",Adenocarcinoma de Barrett,Carcinoma de células escamosas de esófago,Adenocarcinoma gástrico que surge en un,Carcinoma de células escamosas anal,Adenocarcinoma periampular,E
"Niña de 15 años, presenta fiebre, faringitis y adenopatías. En región paracortical, ganglio linfático cervical 
agrandado. El AP revela población polimórfica de células linfoides, incluidas células similares a Reed-Sternberg. 
Estas células grandes son positivas para CD45 y CD30 y carecen de expresión de CD15. En base a estos 
hallazgos, ¿Cuál es el diagnóstico más probable?",Linfadenitis por mononucleosis infecciosa,Linfadenitis por citomegalovirus,Linfoma difuso de células B grandes,Linfoma de Hodgkin clásico,Linfadenitis por Toxoplasma,A
"En una lesión resultante de un traumatismo directo sobre la piel, que produce la destrucción de los estratos basales 
de la epidermis, con afectación leve de la capa basal. ¿A qué tipo de lesión corresponde?",Fractura,Equimosis,Herida contusa,Excoriación,Hematoma,D
¿Cuál de las siguientes condiciones produce un auto infarto del bazo,Enfermedad de Gaucher,Artritis reumatoide,Amiloidosis,Lupus eritematoso sistémico,Anemia de células falciformes,E
¿Cuál es el gen que estando mutado protege a las células tumorales de la apoptosis?,BRCA,RB,TGF-B,FNT,BCL-2,E