questions,option_A,option_B,option_C,option_D,option_E,correct_answer
"Paciente de 7 años, presenta prurito en cuero cabelludo y se observa algunas placas circulares pequeñas de 
alopecia y los pelos se rompen cerca del cuero cabelludo. Examen: adenopatías en la región occipital. ¿Cuál es 
el diagnóstico más probable?",Tiña capitis,Dermatitis seborreica,Alopecia areata,Tricotilomanía,Psoriasis,A
"Dentro de la patología ortopédica del pie, el pie plano valgo es la consulta más frecuente para los ortopedistas 
infantiles. ¿Por qué se caracteriza el pie plano valgo fisiológico, hasta los 4 años de edad?",Pie presenta equino-varo-cavo-aducto,El antepié está desplazado en sentido medial,Pie presenta luxación dorsal fija del navicular,Se observa eversión y abducción del antepié,Pie flexible con ausencia de arco,E
"Recién nacido a término que requirió reanimación cardiopulmonar avanzada, tiene diagnóstico de encefalopatía 
hipóxico-isquémica grado II de Sarnat; se le debe transferir para una hipotermia inducida. Según la mayoría de 
protocolos, para que la hipotermia sea más efectiva. ¿A cuántas horas como máximo después del nacimiento, se 
debe iniciar la hipotermia?",8,12,6,24,4,C
"Usted decide iniciar la ventilación a presión positiva en un recién nacido a término deprimido que no respira, a 
pesar de las medidas iniciales de reanimación. Lo ventila con una presión inicial de 30 cm de H2O para la 
expansión pulmonar en las primeras dos o tres ventilaciones, para luego bajar la presión de ventilación (en cm de 
H2O) a:",5 a 10,15 a 20,10 a 15,20 a 25,25 a 30,B
"Paciente de 10 años, presenta fiebre, cefalea, dolor abdominal y artralgia con una evolución de 4 días. Examen: 
quejumbroso, artritis en rodilla derecha; tórax: no ruidos agregados; abdomen: se palpa hepato y esplenomegalia. 
¿Cuál es el diagnóstico más probable?",Fiebre tifoidea,Leptospirosis,Tuberculosis,Blastomicosis,Brucelosis,E
"Preescolar de 5 años presenta erupciones maculopapulares generalizadas con lesiones independientes, 
acompañada de fiebre de 38°C y malestar general. Resto del examen normal. ¿Cuál es el diagnóstico más 
probable?",Virus coxsackies A5,Roséola,Exantemas por ecovirus,Rubéola,Eritema infeccioso,C
"Niño de 2 años 6 meses, presenta hiperpigmentación del tronco y el cuello, manchas café con leche y vitíligo. 
Examen: estatura baja, pene poco desarrollado, testículos no descendidos. Laboratorio: trombocitopenia, luego 
granulocitopenia llegando a anemia macrocítica. ¿Cuál es diagnóstico más probable?",Hipotiroidismo,Anemia de Fanconi,Enf. de Von Recklinghausen,Síndrome de Shwachman-Diamond,Disqueratosis congénita,B
"Recién nacido, presenta manchas en vino oporto, máculas de tamaño variable bien delimitadas y se localizan en 
la región trigeminal de la cara sobre todo en torno a los párpados. ¿Cuál es el diagnóstico más probable?",Hemangioma,Síndrome de Sturge-Weber,Malformación arteriovenosa,Cutis marmórea telangiectásica congénita,Mancha Salmón,B
"Cuando una niña de 2 años presenta hematuria microscópica aislada asintomática. ¿Qué estudio posterior debe 
realizarse?",Derivar para evaluación nefrológica,Ecografía renal anual,Control mensual de examen de orina por un año,Relación calcio/creatinina en orina mensualmente,Repetir el análisis de orina cada 4 a 6 meses por 2,E
"Adolescente mujer de 12 años, con astenia crónica y dolor óseo. Examen: pálida y algunas equimosis en miembros 
superiores, se palpa hepatoesplenomegalia. Laboratorio de genética-bioquímica: déficit de enzima ácido 
betaglucosidasa y mutación N370S. ¿Cuál es el diagnóstico?",Enfermedad de Gaucher,Enfermedad de Farber,Enfermedad de Krabbe,Enfermedad de Fabry,Déficit múltiple de sulfatasa,A
"Niño que lava vehículos en vía pública, presenta lesiones en piel de extremidades inferiores algunas costrosas, 
engrosadas de color marrón rodeada de eritema; algunas lesiones han evolucionado a necróticas con úlceras 
profundas en sacabocado. ¿Cuál es el diagnóstico más probable?",Atresia pulmonar,Atrio ventricular común,Tetralogía de Fallot extrema,Atresia tricuspídea,Transposición de grandes vasos,D
"¿Qué explica, que al examen clínico de un recién nacido a término se encuentre que el cordón umbilical presenta 
una vena y una arteria?",Es una variante normal del cordón umbilical,"Es una malformación, pero no se asocia a otras",Requiere tratamiento quirúrgico inmediato,No se van a necesitar otros exámenes,Puede asociarse a otra anomalía congénita,E
"Paciente de 12 años, súbitamente presenta evacuaciones frecuentes, acuosas y con cierto olor a pescado, 
vómitos, no fiebre; en el almuerzo comió cebiche de pescado y mariscos. ¿Cuál es el agente causal probable?",Rotavirus,Vibrio cholerae,Salmonella typhi,Shigella dysenteriae,Campylobacter jejuni,B
¿A qué edad de su desarrollo se consolida la identidad sexual de un niño(a)?,2 a 3,3 a 4,4 a 5,5 a 6,6 a 7,A
"Recién nacido de tres días, presenta erupciones en forma moderada en diversas partes de la piel en forma de 
pápulas o pústulas firmes, blanco amarillentas de 1-2 mm con un halo eritematoso; las palmas de las manos y las 
plantas de los pies son respetadas. ¿Cuál es el diagnóstico más probable?",Eritema tóxico,Acropustulosis infantil,Foliculitis pustulosa eosinófila,Hiperplasia sebácea,Milios,A
"¿Hasta qué edad en años, la respiración es predominantemente abdominal?",4,6,3,5,2,B
¿Cuál es la complicación más frecuente que se presenta en una otitis media crónica de larga evolución?,Laberintitis,Absceso epidural,Colesteatoma adquirido,Trombosis del seno sigmoide,Absceso subdural,C
¿Cuál es la anomalía congénita más frecuente en recién nacidos?,Hipotiroidismo,Fenilcetonuria,Pérdida de la audición,Anemia drepanocítica,Galactosemia,C
¿Cuántas horas dura el periodo de adaptación del recién nacido?,4 a 6,"0,5 a 1",2 a 3,8 a 12,13 a 24,A
"Gestante a término, quien 15 días antes del parto presentó varicela. ¿Qué daño por varicela puede ocasionar en 
el neonato?",Varicela grave después de los 10 días de vida,Malformaciones graves,Malformaciones leves,Herpes zoster,Varicela precoz antes de los 10 días de vida,E
"Niño de 8 años, presenta varios episodios de tos durante el día, casi todos los días y rara vez por la noche; ha 
sido diagnosticado como asmático. ¿Qué tipo de asma presenta?",Persistente leve,Persistente moderada,Persistente grave,Crisis asmática moderada,Intermitente,A
"Neonato de 6 días de edad, presenta cianosis y taquipnea. Examen CV: se ausculta el 2° ruido cardíaco muy 
intenso. Rx de tórax: flujo pulmonar aumentado. ¿Cuál es el diagnóstico más probable?",Tetralogía de Fallot severa,Tronco arterioso común,Fístula arteriovenosa,Transposición de grandes vasos,Atresia tricuspídea,D
"Durante el crecimiento en estatura en los niños antes de la pubertad. ¿En qué parte del cuerpo predomina el 
crecimiento?",En el tronco,Columna cervical,Extremidades superiores,Cintura pelviana,Extremidades inferiores,E
"Niño de 7 años, hace 10 días presenta fiebre de 38.5 °C que cede con paracetamol, dolor de garganta, 
tratada hace tres días con amoxicilina 75 mg/kg/día y broncodilatadores; al tercer día de tratamiento, continúa con 
fiebre, decaimiento y se agrega exantema máculopapular en cara y tronco. Examen: sibilancias y espiración 
prolongada. ¿Cuál es el agente etiológico probable?",Virus de influenza,Virus de parainfluenza,Chlamydia trachomatis,Bordetella pertussis,Mycoplasma pneumoniae,E
