questions,option_A,option_B,option_C,option_D,option_E,correct_answer
"Se le interconsulta por gestante de 30 semanas con ecografía rutinaria donde se observa oligohidramnios y feto 
varón con hidroureteronefrosis bilateral, vejiga engrosada y distendida y el signo de ""ojo de cerradura"". Pene y 
testículos ecográficamente normales. ¿Cuál es el diagnóstico más probable?",Estenosis de unión pieloureteral,Estenosis de unión ureterovesical,Megauréter congénito obstructivo,Válvulas uretrales posteriores,Reflujo vesicoureteral severo,D
¿Cuál es la ecuación para calcular la Pdet (presión del detrusor) en el estudio urodinámico?,Pdet = Qmax + Pves,Pdet = Pves - Pabd,Pdet = Pabd + Pves,Pdet = Pabd - Qmax,Pdet = Pabd - Pves,B
¿Cuál de los siguientes enunciados caracteriza a la vasculatura renal?,La arteria renal derecha nace por debajo de la,La vena renal izquierda pasa por debajo de la,La arteria renal izquierda pasa por encima de la,La vena renal derecha nace por encima de la,La vena renal derecha nace por debajo de la,A
Es un anticolinérgico con una mayor afinidad por los receptores M3.,Mirabregon,Tolterodina,Tamsulosina,Flavoxato,Solifenacina,E
"¿Qué informan las estadísticas con respecto al embarazo y la capacidad reproductiva en pacientes trasplantados 
renales?",Los niveles de testosterona en hombres suelen,Solo un 10% de los embarazos concluyen de,Por lo general se restaura la fertilidad tanto en,Las anormalidades congénitas son frecuentes,Se presenta retraso del crecimiento intrauterino,C
"El músculo psoas mayor se origina desde la ...... vertebra dorsal, hasta la ...... vértebra lumbar.",11a / 4a,12a / 5a,12a / 2a,11a / 2a,11a / 3a,B
"Mujer de 40 años, diagnosticada de cáncer renal a células claras, según el TNM: T1bN0M0. ¿Cuál es el porcentaje 
de supervivencia a 5 años que los estudios demuestran para estos casos?",50 - 60,>80,30 - 40,15- 20,<10,B
"Varón de 40 años, refiere un ""crack"" durante la relación sexual, con dolor e inmediata detumescencia del pene 
y aumento de volumen del mismo. Al examen: Pene con gran edema y equimótico, lateralizado hacia la izquierda. 
¿Cuál es el diagnóstico más probable?",Parafimosis,Prepucio redundante,Fractura de pene,Balanopostitis,Contusión peneana,C
"Mujer de 23 años, sufre atropello por mototaxi, refiere dolor en flanco izquierdo. Funciones vitales normales. 
UROTEM con contraste: Riñón izquierdo con hematoma subcapsular, no se evidencia laceraciones corticales ni 
extravasación de contraste. ¿Qué grado de trauma renal le corresponde?",1,2,3,4,5,A
"Varón de 1 año con testículo derecho aumentado de tamaño, duro. Biopsia testicular hace una semana, la AP 
informa: mezcla de células epiteliales y mesenquimatosas en un patrón organoide, presencia de cuerpos de 
Schiller-Duval. ¿Cuál es el diagnóstico anatomopatológico más probable?",Teratoma inmaduro,Quiste epidermoide,Tumor de células de Leydig,Tumor de células de Sertoli,Tumor del Saco Vitelino,E
"Varón de 30 años, llega a emergencia por dolor cólico renal que inició en zona lumbar izquierda y se ha establecido 
en flanco e ingle izquierda, que ha cedido con AINES EV. Sin comorbilidades. Examen de orina: microhematuria, 
no leucocituria. UROTEM sc: cálculo de 4 mm en tercio distal de uréter izquierdo.; leve hidroureteronefrosis 
izquierda; riñón y vía urinaria superior derecha sin alteraciones. ¿Cuál es el tratamiento más adecuado?",Realizar litotripsia extracorporea,Colocación de nefrostomía percutánea,Alta e iniciar deflazacort VO + AINES VO,Realizar reimplante ureteral laparoscópico,Alta e iniciar tamsulosina VO + AINES VO,E
"Mujer de 70 años con antecedente de hospitalización por diverticulitis colónica hace 1 mes. Desde hace 3 días 
presenta neumaturia permanente. ¿Cuál de los siguientes exámenes tiene la mayor sensibilidad y especificidad 
para la sospecha diagnóstica?",Videouretrocistoscopía,Enema baritado,Cistografía miccional retrógrada,Videocolonoscopía.,Tomografía con contraste oral y EV,E
"Paciente varón, en día 15 de post operatorio de trasplante renal, presenta dolor sobre el riñón trasplantado. 
Examen: hipertensión arterial, aumento de creatinina y oliguria. Biopsia del aloinjerto: tubulitis, vasculitis e 
infiltración de células mononucleares. ¿Qué tipo de rechazo es?",Crónico,Hiperagudo,Acelerado,Agudo,Temprano,D
"Varón de 21 años consulta por disuria y secreción uretral, que se inició algunos días después de tener relaciones 
sexuales sin protección. Se solicita Gram se secreción uretral que muestra múltiples glóbulos blancos, pero que 
no visualiza bacterias. ¿Qué antibiótico le prescribiría?",Ciprofloxacino,Doxiciclina,Metronidazol,Ceftriaxona,Penicilina benzatínica,B
"Varón de 70 años con hematuria desde hace 1 mes. UROTEM: tumor renal derecho de 9 cm, trombo tumoral de 
vena renal y de la vena cava inferior con extensión hasta el borde inferior del hígado. ¿Qué estadificación del nivel 
de trombo tumoral de vena cava inferior le corresponde?",I,III,IV,II,V,D
"Las soluciones de preservación, ...... y ...... son igualmente de efectivas y de uso estándar en trasplante de riñón.",Euro-Collins / University of Wisconsin (UW),University of Wisconsin (UW) / HTK,Celsior / Euro-Collins,HTK / Celsior,Euro-Collins / HTK,B
"¿En cuál de las siguientes técnicas quirúrgicas para pieloplastía convencional se realiza una resección completa 
del tramo ureteropiélico estrecho para luego realizar la anastomosis respectiva?",Plastía en YV,Con colgajo pélvico,Intubada,En U invertida,Desmembrada,E
¿Cuál es la dosis de Valaciclovir en el tratamiento inicial del Herpes genital?,1 g cada 12 horas por 7 a 10 días,1 g cada 24 horas por 7 a 10 días,1 g cada 8 horas por 7 a 10 días,1 g cada 6 horas por 7 a 10 días,1 g cada 5 horas por 7 a 10 días,A
"A nivel de la unión corticomedular renal, la arteria interlobular se divide en varias arterias ......, las cuales 
posteriormente, originan unas ramas laterales, las arterias...",interlobulares - intralobulillares.,interlobulillares - aferentes.,intralobulillares - arciformes.,arciformes - interlobulillares.,arciformes - aferentes.,D
"Mujer de 60 años, en estudio por litiasis ureteral derecha. UROTEM s/c: cálculo de 5mm en uréter medio derecho. 
Suprarrenal izquierda con tumoración redondeada, homogénea de 2cm, bordes bien delimitados, UH -3. ¿Cuál es 
el diagnóstico más probable de la masa suprarrenal?",Adenocarcinoma,Feocromocitoma,Oncocitoma,Adenoma,Metástasis,D
¿Cuál es el origen embrionario de los riñones y uréteres?,Ectodermo ventral,Mesodermo intermedio,Esclerotomo,Celoma intraembrionario,Endodermo,B
¿Cuál de las siguientes técnicas quirúrgicas corresponde a una derivación o desviación urinaria no continente?,Mainz,Camey,Mansson,Indiana,Bricker,E
"Mujer de 50 años con incontinencia urinaria y sensación de bulto vaginal con la actividad física. Al examen: POPQ: 
Aa 0, Ba +3, C -6, Ap -3, Bp -3, tvl 6 ¿Cuál es el diagnóstico del prolapso genital?",Cistocele,Enterorectocele,Histerocele,Uretrocele,Uretrocistocele,E
"Niño de 12 años con antecedente de orquidopexia izquierda por criptorquidia a los 4 años. Al examen: Talla 
normal, pene y testículo derecho normales. Testículo izquierdo hipotrófico, consistencia disminuida, en bolsa 
escrotal.  ¿Cuál de los siguientes enunciados corresponde a este caso?",Las células de Leydig del testículo izquierdo,El riesgo de que el testículo izquierdo degenere,La espermatogénesis en el testículo izquierdo,Las,El testículo izquierdo aumentará de tamaño con,A
¿Cuál es la causa más frecuente de hemorragia tardía después de una cirugía renal percutánea?,Fistula pielocutánea,Lesión de vena renal,Pseudoaneurisma arterial,Coagulopatía intrínseca,Lesión arteria interlobular,C
"Varón de 30 años con riñón en herradura y cálculo de 2.5cm a nivel de cáliz superior renal izquierdo que condiciona 
dilatación del mismo. ¿Cuál de los siguientes tratamientos considera que es el más beneficioso para este paciente?",Nefrolitotomía percutánea,Litotripsia endoscópica retrograda,Litotripsia por onda de choque,Nefrolitotomía laparoscópica,Nefrolitotomía convencional,A
"¿Cuánto es el tiempo límite máximo en horas para realizar la destorsión testicular y así evitar mayor necrosis 
del tejido?",6,8,2,4,10,D
"Los receptores ...... inducen a la contracción del detrusor, en respuesta a la ...... liberada desde terminaciones de 
nervios ...",adrenérgicos / noradrenalina / simpáticos.,adrenérgicos / acetilcolina / parasimpáticos.,muscarínicos / noradrenalina / somáticos.,adrenérgicos / acetilcolina / somáticos.,muscarínicos / acetilcolina / parasimpáticos.,E
"¿Cuál de las siguientes técnicas quirúrgicas para ureteroneocistostomía en el receptor de trasplante renal, es la 
que presenta mayor reducción de complicaciones urológicas?",Leadbetter-Politano,Gil- Vernet,Lich-Gregoir,Glenn-Anderson,Barry-Cohen,C
¿Cuál es la composición más frecuente de los cálculos urinarios en adultos con infección urinaria recurrente?,Oxalato de calcio,Ácido úrico,Cistina,Fosfato de calcio,Estruvita,E
"Mujer de 60 años, en PO8 de histerectomía vaginal, desde hace 2 días ha iniciado con escape continuo de orina, 
4-5 pañales diarios, tiene deseos miccionales normales y micción espontanea en volúmenes normales. Al examen: 
Vagina con herida operatoria cerrada, no flogosis, y presencia de líquido claro correspondiente a orina que fluye 
desde cúpula. ¿Cuál es el diagnóstico más probable?",Fístula vesicovaginal,Incontinencia urinaria de esfuerzo,Incontinencia urinaria mixta,Seroma de herida operatoria,Fístula ureterovaginal,E
"Primigesta de 30 semanas con ITU por E. coli. Ecografía: Riñón derecho con dilatación de pelvis renal y de uréter 
en toda su extensión. Riñón izquierdo con dilatación de pelvis renal y uréter en su porción proximal. ¿Cuál es la 
causa más probable de la hidroureteronefrosis derecha?",Hidronefrosis gestacional,Litiasis uréter distal,Estenosis de unión pieloureteral,Reflujo vesicoureteral,Estrechez uréter medio,B
"¿Cuál es la clasificación según el TNM, de un tumor de vejiga que invade la lámina propia?",T2,T1,Ta,Tis,T3,B
El factor patógeno más importante para la formación de cálculos de ácido úrico es...,bajo volumen miccional.,hiperuricosuria.,consumir magnesio.,hipocitraturia.,pH urinario bajo.,E
"Varón de 17 años vive en provincia, desde hace cuatro días presenta dolor en región testicular derecha, de inicio 
súbito con intenso dolor y ascenso testicular por lo que decide viajar a Lima. Examen: Testículo derecho ascendido 
hasta cerca del borde inferior del canal inguinal, aumentado de volumen, tumefacto, muy caliente, 
dura, dolor intenso a la leve presión. Se diagnostica orquiepidimitis, ¿Cuál es su diagnóstico diferencial?",Cáncer de testículo abscedado,Hernia inguino escrotal estrangulada,Gangrena de Fournier,Hidrocele infectado,Torsión testicular complicada,E
"¿Cuál es el subtipo histológico del carcinoma de células renales que se encuentra con mayor frecuencia  en 
pacientes con insuficiencia renal terminal y enfermedad renal quística adquirida?",De células claras,De túbulo colector,Cromófobo,Medular,Papilar,E
"Varón de 30 años, sufre caída de altura, hemodinámicamente estable, moderada hematuria macroscópica al 
ingreso. Hb post transfusión 1 PG: 11.8 g/dl; UROTEM c/c: hematoma peri-renal izquierdo, laceración en polo 
inferior renal de aprox. 2.5 cm, no extravasación de contraste. ¿Qué tratamiento inicial es el más recomendable?",Tratamiento quirúrgico de rescate,Drenaje percutáneo de hematoma,Colocación de endoprótesis ureteral,Lumboscopía exploratoria,Manejo conservador y observación,E
"¿Cuál de los siguientes tipos de cálculos, tiene aspecto ""en reloj de arena"" al microscopio?",Oxalato de calcio dihidratado,Oxalato de calcio monohidratado,Fosfato amonio magnésico,Ácido úrico,Fosfato de calcio,B
"Mujer de 20 años referida de medicina interna por diagnóstico de Esclerosis Tuberosa. TEM abdomen c/c: Riñón 
derecho: 2 masas de aprox. 3cm, heterogéneas (UH -25), bien delimitada. Riñón izquierdo: Masa heterogénea 
(UH-20) de aprox. 4cm, en polo inferior, bien delimitada. ¿Cuál es el diagnóstico más probable?",Angiomiolipoma,Oncocitoma renal,Quiste renal complejo,Nefroma quístico,Rabdoleiomioma,A
"Varón de 25 años, quien presenta lesión medular completa por arma de fuego a nivel de T11. ¿Qué tipo de 
disfunción neuromuscular se observará de forma característica en la urodinamia?",Arreflexia del detrusor,Relajación esfinteriana,Cistometría normal,Hiperactividad del detrusor,Estudio presión flujo normal,D
"Mujer de 57 años en postoperatorio inmediato (6 horas) de histerectomía vaginal, refiere dolor lumbar y abdominal. 
Al examen: No globo vesical. Bolsa colectora de orina con 50ml de orina colúrica. Ecografía: ureterohidronefrosis 
bilateral. Vejiga vacua con balón de sonda foley. ¿Cuál es el diagnóstico más probable?",Trauma ureteral bilateral,Trauma uretral proximal,Insuficiencia renal crónica,Reflujo vesicoureteral bilateral,Trauma cúpula vesical,A
"Varón de 45 años, antecedente de haber sido operado hace un año por trauma abdominal por arma de fuego 
realizándose resección de intestino delgado extenso quedando con el diagnóstico de intestino corto. Actualmente 
con náuseas, vómitos y dolor abdominal intenso en flanco derecho, tipo cólico, irradiado a región mesogástrica y 
suprapúbica del mismo lado. Examen: Abdomen blando, depresible, moderada distensión, con timpanismo, 
doloroso en las zonas referidas, no reacción peritoneal. Laboratorio: 11,000 leucocitos. Hematíes 10 x campo. 
¿Cuál es su diagnóstico?",Infarto intestinal,Colitis tóxica,Urolitiasis aguda,Hernia interna complicada,Obstrucción por bridas y adherencias,C
"Mujer de 46 años con antecedente de nefrectomía parcial laparoscópica derecha por cáncer renal de células claras 
hace 2 meses. TNM: pT1aN0M0. ¿Cómo es la vigilancia postoperatoria que le corresponde?",Analítica sanguínea y TEM abdomen anual,Rx tórax y TEM abdomen cada 6 meses,Examen físico y Rx tórax anual,TEM abdominal y examen físico cada 2 años,Examen físico y analítica sanguínea anual,E
¿Cuál de los siguientes medicamentos promueve la formación de cálculos urinarios de modo indirecto?,Acetazolamida,Indinavir,Triamtereno,Pseudoefedrina,Guaifenesina,A
"¿Cuál es el inmunosupresor cuyo mecanismo de acción es la inhibición de la producción de calcineurina y de 
interleukina-2?",Micofenolato de mofetilo,Globulina antitimocito equina,Azatioprina,Tacrolimus,Sirolimus,D
¿Cuál de los siguientes fármacos es un inhibidor de la calcineurina usado en pacientes trasplantados renales?,Micofenolato,Tacrolimus,Sirolimus,Azatioprina,Baxiliximab,B
"Mujer de 50 años, con urgencia miccional y enfermedad de Parkinson, se le realiza un estudio urodinámico donde 
se observan contracciones involuntarias del detrusor durante la cistometría. Según la clasificación de la ICS. ¿Cuál 
es el diagnóstico urodinámico?",Hiperactividad neurogénica del detrusor,Hiperreflexia sensitiva del detrusor,Hiperactividad idiopatica del detrusor,Hipersensibilidad neurogénica del detrusor,Hiperreflexia idiopática del detrusor,A
"De los siguientes medicamentos inhibidores de la fosfodiesterasa-5. ¿Cuál NO presenta disminución de su 
accionar con la ingestión de comidas grasosas?",Sildenafilo,Tadalafilo,Alprostadil,Vardenafilo,Papaverin,B
"¿Cuál es la enfermedad con alta probabilidad de recidiva en un riñón trasplantado y genera alto riesgo de fracaso 
del injerto?",Diabetes mellitus,Glomeruloesclerosis focal y segmentaria,Enfermedad renal poliquistica autosomica,Nefropatía IgA,Displasia renal,B
"Varón de 32 años, recibe fuerte patada en genitales, refiere dolor en genitales e hipogastrio. Al examen: Globo 
vesical. Escroto con laceración en base y equimosis, testículos sin alteraciones, periné equimótico, meato uretral 
con sangre. ¿Cuál es la sospecha diagnóstica?",Contusión de trígono vesical,Fractura parcial de pene,Trauma uretral posterior,Trauma uretral anterior,Trauma extraperitoneal de vejiga,D
"¿Cuál de los siguientes procedimientos, es un componente del estudio urodinámico que determina la velocidad 
del caudal urinario en función del tiempo y también es un indicador del vaciado vesical?",Estudio presión/flujo,Cistometría,Uroflujometría,Electromiografía,Perfil de presión uretral,C
"La hidroureteronefrosis del embarazo tiene como característica que la dilatación ureteral es bilateral y que no se 
produce por debajo del...",polo inferior renal.,tercio proximal ureteral.,final del sacro.,borde de la pelvis.,unión ureterovesical.,D
¿Cuál es la etiología más frecuente de la formación de cálculos de cálcio?,Hiperoxaluria,Hiperuricosuria,Hipocitraturia,Hipercalciuria,Hipomagnesiuria,D
"El cribado de PSA en la práctica contemporánea utiliza un enfoque de rango normal específico para la edad. 
¿Cuánto debe ser el PSA normal en varones menores de 50 años?",3.5 ng/mL,4.5 ng/mL,2 ng/mL,3 ng/mL,2.5 ng/mL,E
¿Cuál es la causa más frecuente de fístula vesicouterina?,Histeroscopia,Cistoscopia,Cesárea,Legrado,Histerectomia,C
"Paciente varón de 35 años con cuadro de pielonefrifis aguda a repetición, con antecedente de cólicos renales 
frecuentes. Se le realiza estudio de imágenes evidenciándose litiasis renal y el uroculfivo muestra > 100 000 
UFC/ml para Proteus mirabilis ¿Cuál es la enzima bacteriana involucrada en la formación de los cálculos?",Elastasa,Fosfodiesterasa,Urea,Fosfolipasa,Ureasa,E
"Los factores de riesgo para el desarrollo de cáncer de testículo incluyen al testículo no descendido y criptorquidia, 
¿A partir de qué células se desarrolla el tumor maligno?",Germinales,Sértoli,Leydig,mioides,Mesenquimatosas,A
"Varón de 28 años, operado de hernia inguinoescrotal derecha muy grande con cirugía laboriosa. Al día siguiente 
en la visita médica observan testículo del lado operado aumentado de volumen, doloroso, edematoso. Se 
diagnostica orquitis isquémica. ¿Cuál es el manejo?",Orquiectomía,Reintervenir para retiro de malla,Antiinflamatorios y analgésicos,Compresas calientes,Compresas frías,C
"Todos los cálculos renales y ureterales se pueden detectar por tomografía helicoidal con contraste, excepto los 
cálculos de...",ácido úrico.,indinavir.,cistina.,zidovudina.,magnesio.,B
"Varón de 26 años, acude por presentar secreción uretral asociado a disuria. Antecedente: promiscuidad. Ante la 
sospecha de Infección de transmisión sexual por gonorrea. ¿Cuál es el esquema de tratamiento?",Ceftriaxona 250 mg IM + azitriomicina 2 g VO,Ceftriaxona 250 mg IM + azitromician 1 g VO,Ceftriaxona 125 mg IM + azitromician 2 g VO,Ceftriaxona 500 mg IM + azitromicina 500 mg,Ceftriaxona 125 mg IM + azitromicina 1 g VO,E
"Mujer de 56 años, sin antecedentes patológicos, con hematuria. UROTEM: tumoración de uréter proximal izquierdo 
de 4cm e hidronefrosis moderada. TNM: T3,N0,M0. ¿Qué tratamiento es el más recomendable?",Nefroureterectomía radical,Ureterectomía proximal con anastomosis T-T,Ablación láser por ureteroscopía,Ablación láser por vía percutánea,Nefroureterectomía,E
"Varón de 60años, hospitalizado por Covid 19 habiendo sido dado de alta de UCI hace dos días. Antecedente: 
Infarto de miocardio hace un año. Infecciones urinarias recurrentes por hipertrofia benigna de próstata, no fue 
operado por alto riesgo cardiovascular. Se realiza cistoscopía confirmando el origen prostático de la hematuria. Se 
decide iniciar tratamiento médico. ¿Cuál es uno de los fármacos a indicar?",Alfa bloqueadores beta adrenérgicos,Vitamina K,Metilprednisolona,Terlipresina,Beta bloqueadores alfa adrenérgicos,E
"Varón de 18 años de edad, acude por disuria y dolor en pene. Examen: descarga uretral purulenta por uretra 
peneana con ganglios inguinales. Se realiza un hisopado uretral donde se evidencia diplococos intracelulares 
gramnegativos. ¿Cuál es la etiología de la infección?",Chlamydia trachomatis,Herpesvirus simple,Trichomonas vaginalis,Neisseria gonorrhoeae,Mycoplasma genitalium,D
¿Cuál es una complicación frecuente de la hiperplasia benigna de próstata?,Nefrolitiasis,Pérdida función vesical por distensión crónica,Cáncer de riñón,Cáncer de vejiga,Hidronefrosis bilateral,B
"Recién nacido masculino de 24 días de vida que desprendió el cordón umbilical a los 8 días y cuyo ombligo no ha 
cicatrizado. Presenta a su nivel una tumoración roja prominente, circular y que segrega una secreción mucoide. la 
madre a veces nota en ella ruido de gases. El diagnóstico más probable es:",Ombligo amniótico,Persistencia del conducto onfalomesentérico,Onfalocele,Granuloma umbilical,Fistula vésico-umbilical,B
¿Por qué se caracteriza la anatomía de las glándulas suprarrenales?,La suprarrenal derecha limita en su parte,La suprarrenal izquierda limita en su parte,Ambas en posición cefálica con respecto al,Ambas en posición cefálica con respecto al,La suprarrenal izquierda limita en su parte,D
"La unidad funcional del parénquima renal irrigado por la sangre, se denomina...",glomérulo.,túbulo proximal.,túbulo distal.,asa de Henle.,nefrona.,E
"Varón de 23 años sufre accidente de tránsito como peatón, con dolor en hemiabd inferior. Tiene fractura compleja 
de pelvis con diastasis de 2 cm de sinfisis pubiana. El urólogo de guardia es interconsultado por hematuria (60ml) 
al colocarle sonda foley por vía uretral. ¿Cuál de los siguientes enunciados es el más probable con relación a la 
sospecha diagnóstica?",Es una contusión vesical porque hay poca cantidad de hematuria,Es una contusión renal porque tiene dolor en hemiabdomen inferior y hematuria,Es un trauma vesical intraperitoneal porque presenta hematuria y diastasis de sinfisis pubiana,Es un trauma vesical extraperitoneal porque presenta fractura compleja de pelvis y hematuria,Es un trauma renal porque hay hematuria y fractura compleja de pelvis,D
"Mujer de 60 años con diagnóstico de Carcinoma adrenocortical derecho. TEMabd c/c: Tumor heterogéneo de 5cm, 
no invasión de grasa periférica, trombo tumoral en vena suprarrenal y ostium de vena cava inferior. La paciente 
desea una cirugía laparoscópica, sin embargo, Ud. le comunica que no es posible debido a ......, lo cual contraindica 
de forma absoluta dicha técnica.",el gran tamaño del tumor,la afección de la vena suprarrenal,la edad de la paciente,ser una neoplasia maligna,ser una neoplasia muy recidivante,B
"Varón de 40 años con resultado de espermatograma: volumen seminal 2 ml, recuento total de espermatozoides 
50 millones/ml, motilidad progresiva (A+B) 30%, viabilidad 58%, formas anormales 15%. ¿Cuál de las siguientes 
alteraciones presenta?",Oligoespermia,Teratoespermia,Astenospermia,Hipoespermia,Poliespermia,C
"¿Cuál es la variedad más común en su composición química de los cálculos de las vías urinarias? Las piedras 
pueden clasificarse por su química, ubicación e impacto clínico. Los cálculos de oxalato de calcio son la variedad 
más común. La causa metabólica más común encontrada en los formadores de cálculos de calcio es la 
hipercalciuria absortiva. Estos son opacos en la radiografía simple. Los cálculos de fosfato de magnesio y amonio 
(estruvita), comúnmente combinados con fosfato de calcio, están relacionados con la infección urinaria crónica 
con bacterias productoras de ureasa (p. Ej., Proteus spp., Klebsiella)",Fosfato de magnesio,Fosfato de amonio,Bilirrubinato de calcio,Oxalato de calcio,Sales mixtos,D
"La relajación del detrusor inducida por estimulación beta-adrenérgica es mediada principalmente por medio de la 
activación de adrenorreceptores beta...",2.,1.,4.,3.,5.,D
"B. 1. 
C. 4. 
D. 3. 
E. 5. 
 
73. La Escala Internacional de Sintomas Prostáticos-IPSS, es un cuestionario de ...... preguntas, que consiste en …... 
y una pregunta sobre calidad de vida.",nueve / ocho preguntas sobre síntomas,siete / seis preguntas sobre síntomas,diez / nueve preguntas sobre síntomas,seis / cinco preguntas sobre síntomas,ocho / siete preguntas sobre síntomas,E
"Un varón de 38 años de edad previamente sano, presenta dolor abdominal súbito e intenso que se irradia de la 
fosa renal izquierda a la región inguinal y que se acompaña de náuseas, diaforesis y polaquiuria. El paciente se 
encuentra inquieto y se revuelve en la cama, pero no tiene datos positivos en la exploración física. El diagnóstico 
más probable es:",Herpes zoster,Diverficulifis en el sigmoides,Cálculos en el uréter izquierdo,Torsión de testículo izquierdo,Pielonefritis Aguda,C
"En una nefrectomía simple laparoscópica, para rechazar al colon y poder separarlo del riñón, se debe realizar...",una separación del duodeno del riñón.,una incisión en la línea alba de Toldt.,la tracción continua del uréter.,una incisión en el mesenterio colónico.,la separación del uréter de la vena gonadal.,B
"Varón de 35 años presenta dolor cólico renal derecho con irradiación a ingle ipsilateral, leve hematuria. UROTEM: 
cálculo de 4mm en uréter distal a 1cm de unión ureterovesical derecha. Se le inicia AINES EV con mejoría de 
dolor. ¿Cuál es el tratamiento más recomendable con respecto al cálculo?",Tamsulosina + observación,Colocación de cateter doble-jota,Ureterolitotomia baja,Litotripsia extracorporea,Nifedipino + observación,A
