questions,option_A,option_B,option_C,option_D,option_E,correct_answer
"Mujer de 50 años con dolor lumbar por cálculo de 2cm en cáliz inferior de riñón izquierdo (UH 950). ¿Con cuál de 
los siguientes tratamientos se obtendría la mejor tasa de eliminación completa de cálculos?",Nefrolitotomía percutánea,Litotripsia extracorporea por ondas de choque,Litotripsia endoscópica retrograda,Alcalinización de orina con citrato de potasio,Tamsulosina diaria,A
¿Cuál es el tumor testicular más frecuente de un varón de 25 años de edad?,Tumor de las células de Leydig,Coriocarcinoma,Teratocarcinoma,Androblastoma,Seminoma,E
"Mujer de 60 años con leve dolor lumbar izquierdo permanente. UROTEM: riñón izquierdo con quiste cortical de 
3cm con 2 tabiques delgados, no calcificaciones ni realce con el contraste. Según la clasificación de Bosniak. 
¿Qué clase de quiste es?",I,IIF,II,III,IV,C
¿Cuál es el examen que solicitaría Ud. para confirmar el diagnóstico de torsión testicular?,Ecografía simple,Ecografía doppler,Tomografía,Resonancia,Gammagrafía,B
El uréter se origina como una evaginación del conducto...,metanéfrico.,Wolff.,Muller.,mesenquimatoso.,mesonéfrico.,E
"Con respecto al tratamiento de diversas disfunciones vesicales, la toxina botulínica actúa inhibiendo la liberación 
de ...... en las terminaciones eferentes parasimpáticas.",calcio extracelular,sustancia P,acetilcolina,serotonina,glutamina,C
"El esfínter urinario externo consiste en una estructura cilíndrica, tiene una capa interna de ...... y una capa externa 
de...",músculo estriado - colágeno.,músculo liso - músculo estriado.,colágeno - músculo estriado.,músculo liso - colágeno.,músculo estriado - músculo liso.,B
"Adolescente de 13 años que luego de estar practicando deporte, presenta dolor súbito hace 6 horas en región 
escrotal derecha, se acompaña de incremento de volumen del mismo escroto, por lo que se automedica con 
analgésicos, pero el dolor persiste. Examen: PA: 110/70mmHg. FC: 110/min. T° 37.3°C, se evidencia asimetría 
de ambos escrotos con incremento de volumen a predominio derecho y con mucho dolor a la palpación.Se 
sospecha de torsión testicular. ¿Cuál es la conducta a seguir?",TAC testicular,Eco- Doppler,Exploraciòn quirúrgica,Trans-iluminaciòn,Destorciòn manual,B
"Para la enfermedad localizada de cáncer de próstata, ¿Cuál de los siguientes procedimientos de prostatectomía 
es actualmente la más reciente y aceptada?",Resección trans ureteral total,Resección trans ureteral parcial,Prostatectomía laparoscópica anterior,Prostatectomía trans vesical,Prostatectomía laparoscópica asistida por robot,E
"Varón de 60 años con tumoración renal. TEM toracoabdominal: tumor renal izquierdo de 6 cm en polo inferior, no 
atraviesa cápsula renal; presencia de linfadenomegalias paraaórticas izquierdas. Ausencia de metástasis a 
distancia. ¿Qué estadiaje le corresponde?",III,I,II,IV,V,A
¿Cuál de los enunciados corresponde a una característica de la crioablación de tumores renales?,Se utiliza el gas Argón para obtener,El área de tratamiento debe extenderse como,Se utiliza sistemas en base a Hidrogeno para,Actualmente el estandar de tratamiento es un,Se puede realizar el procedimiento sin tener,D
"Varón de 25 años refiere eyaculación precoz primaria, sin antecedentes de importancia, el examen físico es 
normal. ¿Cuál de los siguientes medicamentos es el recomendable como tratamiento?",Alprostadil,Tramadol,Tadalafilo,Imipramina,Dapoxetina,E
"Varón de 2 años con ITUs febriles recurrentes, se le realiza una cistouretrografía miccional, donde se observa 
riñón derecho con presencia del contraste en uréter, pelvis renal y cálices, sin dilatación. ¿Qué grado de reflujo 
vesicoureteral le corresponde?",1,2,3,4,5,B
"Mujer de 45 años, trasplantada renal de donante vivo hace 2 semanas, en tratamiento inmunosupresor respectivo. 
Inicia con elevación de la presión arterial y aumento lento de la creatinina. Afebril, no cambios en volumen urinario 
ni dolor en zona del injerto. Biopsia del injerto: sin anormalidades. ¿Cuál es la sospecha diagnóstica?",Toxicidad del inhibidor de calcineurina,Rechazo agudo del injerto,Infección urinaria complicada,Infección por citomegalovirus,Trombosis de la vena renal del injerto,A
"Varón de 40 años, trasplantado renal, refiere disfunción eréctil. Exámenes hormonales: testosterona baja, FSH 
elevada, LH elevada, prolactina normal. ¿Qué medicamento está generando este efecto adverso?",Sirolimus,Metildopa,Prednisona,Cilcosporina,Clonidina,A
¿Cuál es el tipo de tumor que con mayor frecuencia origina el cáncer de testículo?,Intersticial,De células germinales,De células de Leydig,De células de Sértoli,Linfomatoso,B
"Varón de 70 años, realiza el cuestionario del IPSS, cuyo puntaje corresponde a síntomas moderados. ¿Cuál de 
los siguientes puntajes le corresponde?",6,21,10,30,35,C
El 70 a 80% de todos los carcinomas de células renales comprenden al subtipo...,renal medular.,de túbulo colector.,células claras.,cromófobo.,papilar.,C
¿Cuál es el tumor renal benigno más frecuente?,Oncocitoma,Adenoma metanéfrico,Adenoma renal,Angiomiolipoma,Nefroma quístico,A
"Ud. está realizando una pielolitotomía lap izquierda a un varón de 50 años, al exponer la pelvis renal, se lacera la 
Aorta abdominal generando una hemorragia intensa. El paciente se mantiene hipotenso por aprox. 3 horas en que 
se contiene la hemorragia y se estabiliza la hemodinamia. En el postoperatorio, presenta anuria, acidosis con 
hiperkalemia y elevación de la creatinina ¿Cuál de las siguientes es probablemente la causa de la insuficiencia 
renal aguda?",Esclerosis glomerular,Glomerulonefritis mesangial,Atrofia tubular distal,Hialinización glomerular,Necrosis tubular aguda,E
"En el estudio urodinámico, la electromiografía sirve para evaluar posibles alteraciones de …",la función muscular perineal.,el músculo detrusor.,la resistencia uretral.,los nervios somáticos perineales.,la contracción del trígono.,A
"Varón de 20 años con dolor testicular izquierdo intermitente. Al examen: paciente en decúbito dorsal, no 
anormalidades escrotales visibles, se palpa plexo venoso de cordón testicular dilatado. ¿Qué grado de varicocele 
le corresponde?",1,3,4,2,5,D
"Mujer de 60 años, con Parkinson, con escape de orina con urgencia miccional. Urodinamia: cistometría con 
contracciones involuntarias de hasta 80cmH2O que producen escape de orina. ¿Cuál es el diagnóstico 
urodinámico?",Hiperreflexia neurogénica del detrusor,Inestabilidad neurogénica del detrusor,Hiperactividad hiperrefléxica del detrusor,Inestabilidad hiperrefléxica del detrusor,Hiperactividad neurogénica del detrusor,E
"Mujer de 30 años, VIH positivo en TARGA desde hace 2 años; presenta dolor súbito lumbar derecho intenso. 
Ecografía: hidronefrosis renal derecha, imagen hiperecogénica con sombra posterior en unión ureteropiélica de 
aproximadamente 1 cm. UROTEM sin contraste: dilatación moderada de pelvis renal derecha, no se observan 
imágenes hiperdensas en vía urinaria. ¿Cuál es el diagnóstico más probable?",Estrechez ureteropiélica,Quiste parapiélico,Urolitiasis de cistina,Urolitiasis coraliforme,Urolitiasis por indinavir,E
