questions,option_A,option_B,option_C,option_D,correct_answer
¿Cuál es el signo clínico que consiste en percutir la uña del pulgar o índice?,Sturger,Hueber,Hoffman,Queen,C
"Es criterio diagnóstico de hidrocefalia en TC, el índice de EVANS >0,3 que se obtiene de dividir, en el mismo corte 
tomográfico, las dimensiones del ancho mayor entre las ...",astas occipitales y el diámetro interno máximo.,astas temporales y el diámetro biparietal máximo.,astas frontales y el diámetro biparietal máximo.,astas frontales y el diámetro interno máximo.,C
"Mujer de 45 años; ingresa con fiebre, rigidez de nuca, alteración del estado mental y crisis epilépticas. Antecedente: 
sinusitis crónica. TC: imagen en semiluna, hipodensa (pero con mayor densidad que el LCR) y desvío de línea media. 
¿Cuál es el diagnóstico?",Hematoma subdural,Absceso cerebral,Higroma subdural,Empiema subdural,D
"Mujer de 35 años, con cervicalgia. RM columna cervical: T1 y T2 se encontró el cuerpo vertebral de C4 con componente 
intraóseo hiperintenso, interrumpido por barras verticales hipointensas, no se visualizan trabéculas horizontales, ¿Cuál 
es el diagnóstico?",Metástasis vertebral,Sarcoma de Ewing,Hemangioma vertebral,Enfermedad de Paget,C
"En el abordaje nasal endoscópico de la base de cráneo, el rostro del esfenoides se articula con el hueso:",Etmoides,Esfenoides,Vómer,Frontal,C
¿Cuál es una manifestación de ruptura inminente de aneurisma cerebral?,No afección de pares craneales,Vasoespasmo,Signo del aneurisma pulsátil,Tamaño constante del aneurisma,C
La hormona  .....  es sintetizada por neuronas ...... y liberadas por la ...,corticoliberina / hipofisiarias / adenohipófisis.,prolactina / hipotalámicas / neurohipófisis.,somatoestatina / hipofisiarias / adenohipófisis.,arginina vasopresina / hipotalámicas / neurohipófisis.,D
Se denomina velum interpositum al espacio entre ambas capas de la tela coroidea …,en el piso del III ventrículo.,en el techo del III ventrículo.,en la pared anterior del III ventrículo.,que discurre entre ambos fórnix.,B
El líquido céfalo-raquídeo tiene una dirección de flujo en su recorrido:,Sale del sistema ventricular a través de tres agujeros (de Luschka y Magendie),Circula por el agujero de Monro (que es único) y pasa del III ventrículo al acueducto,Se principalmente en las granulaciones de Pacchioni (de los ventrículos laterales),Ee absorbe fundamentalmente en los plexos coroideos (de los últimos ventrículos),A
"Mujer de 48 años, obesa en perimenopausia, acude por emergencia con cefalea severa, náusea y acúfenos; refiere que 
presentó amaurosis que revirtió 2 horas después. Examen: papiledema bilateral. TC craneal y RM normales. PL con 
presión de apertura >25 cm H2O. Citoquímico en rangos normales. ¿Cuál es el diagnóstico?",Meningitis carcinomatosa,Tumor cerebral a determinar,Enfermedad desmielinizante de primera neurona,Hipertensión intracraneal idiopática,D
"En el abordaje retrosigmoideo, una forma de identificar el conducto auditivo interno es reconocer las estrías verticales 
que presenta la duramadre a nivel de la cara posterior del hueso petroso, cuando la duramadre se vuelve lisa, indica la 
pared posterior del conducto auditivo interno, dicha línea es la de ...",petrosal superior.,Traumant.,Sharmman.,Tubingen.,D
"Varón 44 años con tumoración en el cuerpo carotídeo, con antecedente clínico familiar y personal de MEN2, es una masa 
indolora, pero siente un efecto de compresión en la zona del cuello. ¿Cuál es el diagnóstico?",Paraganglioma,Tumor Glómico,Ganglioneuroma,Neuroblastoma,A
"Varón de 55 años refiere que puede leer pero no puede escribir, se confunde entre izquierda/derecha y tiene incapacidad 
para reconocer los dedos por su nombre. Nuestro diagnóstico neurofisiológico encefálico regional es síndrome ...",del lóbulo occipital.,de Foster-Kennedy.,de Parinaud.,de Gerstmann.,D
"En la estadificación histológica de los abscesos cerebrales parenquimatosos, el estadío ...... corresponde a la aparición 
de ...",4 - cerebritis tardía.,2 - cápsula tardía.,3 - cápsula inicial.,2 - cerebritis inicial.,C
Un ..... puede ocasionar hidrocefalia por ...,glioblastoma multiforme - infiltración de la línea media.,macroadenoma hipofisiario - compresión del III ventrículo.,meduloblastoma - compresión de ventrículo lateral.,meningioma de la hoz - compresión acueductal.,B
"En relación al diagnóstico imagenológico del hemangioblastoma raquídeo, son características típicas en una RM con 
administración de medio de contraste paramagnético:",Se trata de una lesión neoplásica benigna extramedular primaria,Existe escaso componente vascular por lo que no pueden apreciarse vasos sanguíneos,Su realce tras la administración de contraste es muy tenue casi imperceptible,Se observan pequeños nódulos con expansión focal de la médula,D
"Mujer de 44 años con hipertensión endocraneal, se mide su presión en mmHg por medio de línea arterial: la sistólica en 
115, la diastólica en 55, si su presión de perfusión cerebral es 50 mmHg. ¿Cuánto es el valor de la presión intracraneal 
en mmHg?",25,23,27,30,A
"Varón de 22 años que tras un sismo le cae roca en la región temporal derecha, ocasionándole fractura temporal derecha. 
¿Cuáles serían sus lesiones secundarias más frecuentes?",Hematoma epidural izquierdo y hemorragia contusional derecha,Hemorragia epidural derecha y hematoma epidural izquierdo,Hematoma epidural derecho y hemorragia contusional izquierda,Hemorragia subdural derecha y hemorragia contusional derecha,C
"¿Cuáles son las arterias más comúnmente relacionadas con la compresión del V y VII pares craneales, respectivamente?",Cerebelosa superior y cerebelosa posteroinferior,Cerebelosa anteroinferior y calcarina superior,Cerebelosa superior y cerebelosa anteroinferior,Cerebelosa superior y bulbar anterior,C
"En la Emergencia de Neurocirugía en el Hospital Lima Este Vitarte examinamos un niño de 14 años que ingresa por 
reciente hemiplejía y trastorno del sensorio. Glasgow 9. TC: hematoma intraparenquimal extenso en ganglios basales con 
desvío de línea media de 9 mm. En la búsqueda de la causa del sangrado y planeamiento quirúrgico. ¿Cuál es la 
indicación inmediata?",AngioTC para craniectomía descompresiva y simultáneo clipaje aneurismal,AngioTC para craneotomía evacuatoria cuidando no lesionar la probable MAV,Manejo en neuro-UCI preparando al paciente para su tratamiento endovascular,Panangiografía digital de encéfalo como gold standar de patología cerebro-vascular,B
"Lactante (nacido a término) de 4 meses de edad, fontanela tensa, perímetro cefálico aumentado, no controla bien su 
cabeza, retraso del desarrollo. TC: zonas periféricas hipodensas sobre los lóbulos frontales, tamaño ventricular y 
encefálico normales. ¿Cuál es su diagnóstico?",Hidrocefalia fisiológica del neonato,Hematoma subgaleal post-parto,Colección subdural benigna del lactante,Cáput succedáneo,C
Los criterios anatomopatológicos de St. Anne-Mayo para astrocitomas incluyen ...,"proliferación endotelial, atipia nuclear, miosis, y necrosis.","atipia nuclear, mitosis, proliferación endotelial y necrosis.","atipia nuclear, mitosis, proliferación mesotelial y meiosis.","necrosis, atipia nuclear y proliferación endotelial.",B
En casos de hernia discal en la RM podemos encontrar con cierta frecuencia que ...,el ligamento longitudinal común posterior esté roto a causa de una hernia subligamentaria.,"una hernia migrada, necesariamente ha roto el ligamento común posterior.","un fragmento discal quede libre, sin tener contacto con el disco intervertebral.",una hernia transligamentaria conserve indemne su ligamento común posterior.,C
"Varón 45 años, con antecedentes de bronquiectasia a repetición. Acude por cefalea constante, crisis convulsiva. Glasgow 
12. TC contrastada: imagen hipodensa con realce en anillo y edema perilesional de 3.5 cm pegado a ventrículo lateral. 
¿Cuál es el diagnóstico y tratamiento?",Linfoma cerebral primario / Biopsia cerebral,Absceso cerebral / Evacuación quirúrgica,Absceso cerebral / Observación,Toxoplasmosis / Corticoterapia,B
"Neonato de 2 semanas con mielomeningocele. Examen: Aducción normal de la cadera y extensión casi normal de la 
rodilla. ¿Cuáles son los objetivos esenciales de la cirugía?",Restituir la función neurológica,Liberar placoda de duramadre y cerrar la piel,No separar la placoda y cerrar herméticamente duramadre y piel,"Liberar placoda de duramadre, cierre dural hermético y cerrar la piel",D
"La triada de Cushing se presenta en hipertensión endocraneana severa, incluye .......y se ve en un ...... %  de pacientes.","hipotensión arterial, taquicardia y polipnea / 40","hipertensión arterial, bradicardia y trastornos respiratorios / 33","hipertensión arterial, bradicardia y trastornos respiratorios / 45","hipotensión arterial, taquicardia y bradipnea / 50",B
"Mujer de 85 años, después de caída sentada, acude con dolor intenso a nivel de región lumbar, no déficit motor. TC 
lumbosacra: fractura por aplastamiento de L2 en el 20% de cuerpo vertebral, con muro posterior intacto. ¿Cuál es el 
tratamiento indicado?",Vertebroplastía percutánea con cemento,Alta y sólo analgésicos,Artrodesis transpedicular con 6 tornillos mínimamente invasivo,Laminectomía L2 para liberación de la médula,A
"Paciente acude a emergencia con cefalea muy intensa paroxística de inicio brusco. TC craneal: HSA difusa con más de 
1 mm de espesor. ¿Cuál es su clasificación de Fisher?",II,I,III,IV,C
"Un paciente es diagnosticado de daño axónico difuso; la familia pide reunirse con el equipo de neurocirujanos. Debemos 
explicarles que se trata de una...",lesión primaria producto del traumatismo.,lesión secundaria diagnosticable por TC.,consecuencia de los hematomas epidural y subdural coexistentes.,afectación con focos hemorrágicos en cuerpo calloso y tronco encefálico.,A
